Tweet,Negative,Positive,Overall Sentiment,Positive Words,Negative Words
wellbeingwednesday harvard school public health found femal drink minimum four cup coffe per day could lower risk depress,1.0,0.0,Negative,[],"['lower', 'risk', 'depress']"
let depress slow work ethic probabl wont releas music next week like origin want,0.4575835475578406,0.5424164524421593,Negative,['like'],['depress']
rt rt profit advertisingpromot junkfood heighten blood sugar inflamm henc obes depress,0.5250659630606861,0.47493403693931396,Negative,['profit'],['depress']
overcom depress rc blakesjr via,1.0,0.0,Negative,[],['depress']
yall screengrab send fave idc she toxic wethu sogqiba azimel nge depress,0.5250659630606861,0.47493403693931396,Negative,['fave'],['depress']
depress antidepress,1.0,0.0,Negative,[],['depress']
thing depress never see low come wake bubbl content ambush know your sunken place,0.6372881355932204,0.36271186440677966,Negative,[],"['depress', 'low']"
million peopl suffer depress worldwid video youll get action step start help treat depress symptom,0.6473509933774835,0.3526490066225166,Negative,"['help', 'treat']","['suffer', 'depress', 'depress']"
dont think anxieti depress sad stress impact physic health think,0.692167577413479,0.30783242258652094,Negative,[],"['depress', 'sad', 'stress']"
anxieti suck depress suck,1.0,0.0,Negative,[],"['suck', 'depress', 'suck']"
doctor doesnt provid ivketamin depress treatment suicideprevent psychiatri,0.0,1.0,Positive,[],['depress']
could one puff cannabi eas depress weedwatchacbt apht bloc chooc cmedt cronv emcv emhv firev gwph hikuc leaft mymc nc ninev ogiv rqbc snnc terc thcxv weedtacmpr cannabi,1.0,0.0,Negative,[],['depress']
sympathi demon tri cure depress focu get curropt leader arrest innoc girl wtf benefit serv jail time,0.7581967213114754,0.24180327868852458,Negative,['benefit'],"['depress', 'arrest', 'wtf']"
anyon gon na tri get ahold ill take bunch depress nap today,1.0,0.0,Negative,[],"['ill', 'depress']"
total know give life go embrac take med depress realli screw way bodi work quit med thing help dog,0.6293929712460065,0.37060702875399365,Negative,['help'],"['depress', 'screw']"
alright blindboy what hot take altright lad say depress mental ill isnt real attent seek st world problem person think theyr troll wonder thought,0.8132183908045977,0.18678160919540232,Negative,['alright'],"['depress', 'ill', 'problem']"
black patent dont believ depress fam,0.0,1.0,Positive,[],['depress']
alway peopl dont deal anxieti depress speak anxieti depress stfu emoji unamus face,0.5491329479768786,0.45086705202312144,Negative,[],"['depress', 'depress']"
benefit neuro aerobicsstrengthen immun systemrevers heal prevent depress anxieti panic disord ocdetcprev dramat slow progress dementia alzheim neurolog disordersexpand busi,0.48516949152542377,0.5148305084745762,Negative,"['benefit', 'progress']","['depress', 'panic']"
lone millenni twice like experi depress anxieti find studi,0.6796460176991151,0.32035398230088497,Negative,['like'],"['lone', 'depress']"
work produc lo angel matter would stop go gym swimholdontoyourvoic homagi caregiv mentalhealth caregiv depress mentalil caregiv april wednesday humpday wellcaregiverwednesday homag,0.8313725490196078,0.16862745098039214,Negative,[],"['stop', 'depress']"
whiteladi good crisi mode anyth yet weather isnt help depress,0.29032258064516125,0.7096774193548386,Positive,"['good', 'help']",['depress']
chang life help footbal save depress almost suicid today continu help other,0.27181208053691275,0.7281879194630873,Positive,"['help', 'save', 'help']",['depress']
suicid hotlin addict hotlin eat disord hotlin self harm hotlin depress hotlinemi dm lone thot hotlineshar someon might realli need phone number,0.871866295264624,0.12813370473537605,Negative,[],"['harm', 'depress', 'lone']"
depress your worthlessanxieti cool let overanalyz worthlessnessmi brain,0.5815899581589958,0.41841004184100417,Negative,['cool'],['depress']
depress cure,1.0,0.0,Negative,[],['depress']
someon anxieti depress tell need seat,1.0,0.0,Negative,[],['depress']
meme iron depress chronic,1.0,0.0,Negative,[],['depress']
impair impair im feel second class worker drive work forc pill cocktail caus depress go coupl lunch beer like princ elvi pro need chemistri set bigger budget look,0.5611111111111111,0.4388888888888889,Negative,['like'],['depress']
crippl depress,1.0,0.0,Negative,[],['depress']
hell isnt locat state mind anxieti fear depress demon center problem your one pull string,1.0,0.0,Negative,[],"['hell', 'fear', 'depress', 'problem']"
exercis slash risk depress via,1.0,0.0,Negative,[],"['slash', 'risk', 'depress']"
hair growth abat depress possibl increas psa,0.5512104283054005,0.44878957169459965,Negative,['growth'],['depress']
idk feel anxieti depress,1.0,0.0,Negative,[],"['idk', 'depress']"
nycdcc recognit children mental health awar week nation institut mental health nimh host twitter chat discuss teen depress chat take place thur may pm follow join convers mentalhealth,0.5930232558139535,0.40697674418604657,Negative,['join'],['depress']
who go background check suppos cant get gun depress autism whatev univers ban weapon war peopl,0.6749116607773851,0.3250883392226148,Negative,[],"['gun', 'depress', 'ban', 'weapon', 'war']"
parti depress turn life upsid,1.0,0.0,Negative,[],['depress']
anyway enough depress shit one care,0.6801040312093628,0.3198959687906372,Negative,['care'],"['depress', 'shit']"
anxieti depress pizza emoji slice pizza,1.0,0.0,Negative,[],['depress']
want get someth chest firstli disclaim suffer depress suicid thought skip thread back regularli schedul program soon,0.8379120879120879,0.1620879120879121,Negative,[],"['suffer', 'depress']"
goodmorn everyon except depress kill robin william,1.0,0.0,Negative,[],"['depress', 'kill']"
probabl quit opposit cure depress wasnt depress,0.549165120593692,0.450834879406308,Negative,[],"['depress', 'depress']"
depress anxieti isolatingpeersupport help tough timestwo support group meeteveri thursday prestonwhen wheretak look emoji point backhand indexno need book come along theyr friendli bunch emoji smile face,0.3736263736263737,0.6263736263736264,Positive,"['help', 'support', 'smile']","['depress', 'tough']"
got love your stronger depress faith ili,0.25030826140567203,0.749691738594328,Positive,"['love', 'stronger', 'faith']",['depress']
consid one hottest place earth ethiopia danakil depress environn could shed light possibl life mar titan nuclear wast sitessci astrobiolog mar tourism wednesdaywisdom,1.0,0.0,Negative,[],['depress']
wit much injustic suffer eventu lead depress,1.0,0.0,Negative,[],"['suffer', 'depress']"
im sure liver stoke im take depress anymor,0.5815899581589958,0.41841004184100417,Negative,['sure'],['depress']
want listen music speak social issu govern depress korean cultur suggest bt interest broaden mind meaning lyric inspir book theori pleas giv,0.4275618374558303,0.5724381625441696,Negative,['interest'],['depress']
resent turn deep depress,1.0,0.0,Negative,[],"['resent', 'depress']"
smell depress,1.0,0.0,Negative,[],['depress']
overwhelm week depress,1.0,0.0,Negative,[],"['overwhelm', 'depress']"
us suicid depress addict arent select militaryspous success,1.0,0.0,Negative,['success'],['depress']
depress paradox spend twice long bed half motiv wash bed sheet,1.0,0.0,Negative,[],"['depress', 'paradox']"
jetaim thank year abus old job month worthless due depress unemploy ive done complet,0.7084282460136674,0.29157175398633256,Negative,['thank'],"['worthless', 'depress']"
depress peak abandon heartbroken terrifi blame didnt know id survivebut thought lost someon dear introduc circl almost immedi felt,0.8526863084922011,0.147313691507799,Negative,['dear'],"['depress', 'abandon', 'heartbroken', 'blame', 'lost']"
weve got heat wayemoji fire emoji fire emoji firewer talk student mental health new data reveal quarter south african suffer depress weve also got new track test fake news detect capabl,1.0,0.0,Negative,[],"['fire', 'fire', 'suffer', 'depress', 'fake']"
stock mkt crash depress caus govt tax spend work yr cut govt free mkt individu liberti like coolidg would recov much sooner,0.5803571428571429,0.41964285714285715,Negative,"['free', 'like']","['crash', 'depress', 'cut']"
idk ive gone depress feel lot emot pain watch tv spoke friend grant didnt leav bed day yeah use distract,0.5611015490533563,0.43889845094664376,Negative,"['friend', 'grant', 'yeah']","['idk', 'depress', 'pain', 'distract']"
hi would like advic relaps depress time bad skip prayer didnt f hihav consult profession regard depress pleas,0.797872340425532,0.2021276595744681,Negative,['like'],"['depress', 'bad', 'depress']"
depress suddenli cure,1.0,0.0,Negative,[],['depress']
vitamin b defici caus memori loss depress check level,0.7135231316725978,0.2864768683274021,Negative,['vitamin'],"['loss', 'depress']"
depress work much like thisminor inconveniencestress situat happensmi brain bang pot togeth death death death death death death,0.913978494623656,0.08602150537634409,Negative,['like'],"['depress', 'death', 'death', 'death', 'death', 'death', 'death']"
real talk kany never pull fulli depress suffer mum passedthen marri drama fill kardashian famili didnt help matter,0.7220843672456576,0.27791563275434245,Negative,['help'],"['depress', 'suffer']"
class hospit base eat disord treatment hospit reestablish bipolar med wit murder recent suspect brain tumor plu usual issu depress anxieti,1.0,0.0,Negative,[],"['murder', 'suspect', 'tumor', 'depress']"
woke im alreadi think take depress nap,1.0,0.0,Negative,[],['depress']
next theyr gon na say porn cure depress lmao,0.4503968253968254,0.5496031746031746,Positive,['lmao'],['depress']
ha repost ha getrepostth cure depress,0.40027510316368636,0.5997248968363136,Positive,"['ha', 'ha']",['depress']
engag physic activ decreas peopl chanc develop depress via xpress,1.0,0.0,Negative,[],['depress']
depress wanima,1.0,0.0,Negative,[],['depress']
depress hell insid eat daili,1.0,0.0,Negative,[],"['depress', 'hell']"
depress intensifi,1.0,0.0,Negative,[],['depress']
us children teen anxieti depress,1.0,0.0,Negative,[],['depress']
doc treat depress po fight,0.7770562770562771,0.22294372294372294,Negative,['treat'],"['depress', 'po', 'fight']"
republican polici ideolog brought world brink sever depress mire us deep recess audac whatev power obstruct obama administr lead us bullshit morningjo,1.0,0.0,Negative,[],"['depress', 'bullshit']"
good morn everyon except peopl told jesu would fix depress let im go therapist first time today,0.5259515570934256,0.4740484429065744,Negative,['good'],['depress']
post concert depress thing thing experienc strongli,1.0,0.0,Negative,[],['depress']
depress test today psycholog class guess student class depress,1.0,0.0,Negative,[],"['depress', 'depress']"
lol depress hit hard,0.6220204313280364,0.3779795686719637,Negative,['lol'],"['depress', 'hard']"
aint stress bitch aint depress emoji hundr point symbol,0.0,1.0,Positive,[],"['stress', 'bitch', 'depress']"
depress came back,1.0,0.0,Negative,[],['depress']
point beyond depress anger short suicid murder that find,1.0,0.0,Negative,[],"['depress', 'anger', 'murder']"
funni depress cool,0.5815602836879433,0.41843971631205673,Negative,['cool'],['depress']
sign today join countless other lift stigma women suffer mmh disord like postpartum depress let seriou light mom suffer dark,0.6847389558232932,0.3152610441767068,Negative,"['join', 'like']","['suffer', 'depress', 'suffer']"
depress kill anim,1.0,0.0,Negative,[],"['depress', 'kill']"
sometim depress look like abl get bed knowthesign,0.5614754098360656,0.4385245901639344,Negative,['like'],['depress']
quizz depress sex fuck cheerlead jacki nude elizabeth berkley nude photo home sex,0.7128099173553719,0.28719008264462814,Negative,['cheerlead'],"['depress', 'fuck']"
help much depress dan incred video philosoph outlook life phil unwav posit mean much lot peopl never forget much good,0.5625,0.4375,Negative,"['help', 'good']","['depress', 'forget']"
beta wherev els good evid take consider credit prevent total intern bank collaps result econom depress epic proport,0.3260340632603406,0.6739659367396593,Positive,"['good', 'credit']",['depress']
scienc say peopl burn frankincens less like suffer depress,0.7358490566037736,0.2641509433962264,Negative,['like'],"['suffer', 'depress']"
distant dwell miseri trigger depress happi feel good past day yeah wan na take break spend time stuff likelov,0.3265822784810127,0.6734177215189874,Positive,"['dwell', 'good', 'yeah']",['depress']
word day depress,1.0,0.0,Negative,[],['depress']
say alpha male talk chelsea give depress,1.0,0.0,Negative,[],['depress']
took day tomorrow season depress lift im easili trigger right need space empti hous woo keep bust pant ass fat sooo need shopemoji face tear joy emoji loudli cri facei wish im take date emoji hug face,0.34545454545454546,0.6545454545454545,Positive,"['woo', 'joy', 'wish', 'hug']","['depress', 'ass']"
name,0.0,0.0,Negative,[],[]
worst mood drop ate shit ton sandwich depress gone,1.0,0.0,Negative,[],"['worst', 'drop', 'shit', 'depress']"
newtrip depress induc total mastectomi breast conserv surgeri breast reconstruct systemat,1.0,0.0,Negative,[],['depress']
hope spent last two day couldnt sleep think would lost mind without internet boredomfrustrationdepress stsring ceil think thing,0.44081632653061226,0.5591836734693878,Positive,['hope'],['lost']
three common misconcept depress,1.0,0.0,Negative,[],['depress']
that depress anxieti work cant think simethibg els make go away,1.0,0.0,Negative,[],['depress']
rt mother depress may neg impact child iqto know inform neurolog neurocognitivedisord visit accord cdcp mother depress neg affect ch,1.0,0.0,Negative,[],"['depress', 'depress']"
yoga often recommend depress inflamm true make sens find relief yoga would also make sens bipolar day feel great day im look crawl rock depress doyoga,0.3395061728395062,0.6604938271604939,Positive,"['recommend', 'true', 'relief', 'great']","['depress', 'depress']"
feel like im lose battl depress right nowemoji loudli cri face,0.703125,0.296875,Negative,['like'],"['lose', 'depress']"
togeth end depress,1.0,0.0,Negative,[],['depress']
obes children prone depress low selfesteem neg bodi imag health nutrit program help lasbestgam donat team,0.6614173228346457,0.33858267716535434,Negative,['help'],"['depress', 'low']"
stop depress,1.0,0.0,Negative,[],"['stop', 'depress']"
sighmum what wrongm tiredmum tire havent even done anythingy dont thing get tire call depress hi,1.0,0.0,Negative,[],['depress']
hi name kuuku struggl disappoint depress suicid thought anger feel lost left behind life also situat need someon talk definit talk dm,1.0,0.0,Negative,[],"['disappoint', 'depress', 'anger', 'lost']"
explain mom depress mental ill like neat meme like everyon like await releas sweet death goe what sweet deathand like deathand goe oh thought talk movieand,0.3273542600896861,0.6726457399103138,Positive,"['like', 'neat', 'like', 'like', 'await', 'sweet', 'sweet', 'like']","['depress', 'ill', 'death']"
man fuck depress,1.0,0.0,Negative,[],"['fuck', 'depress']"
icymi rob hirst midnight oil share famili histori depress,0.755,0.245,Negative,['share'],"['rob', 'depress']"
ye dear cours realiz peopl suffer depress respons psychologist sister teacher parent help tell strong without health damag quran brought us answer,0.4376321353065539,0.5623678646934461,Positive,"['dear', 'help', 'strong']","['suffer', 'depress']"
depress suck,1.0,0.0,Negative,[],"['depress', 'suck']"
clinic depressionanxieti mood neg think ploy attain attent praisethink like thisunw destruct visitor made person mindbodi home help creat exitsin find respit,0.3954983922829582,0.6045016077170418,Positive,"['like', 'help']",['destruct']
mother depress may neg impact child iqto know inform neurolog neurocognitivedisord visit accord cdcp mother depress neg affect child cognit develop age,1.0,0.0,Negative,[],"['depress', 'depress']"
two lesson learnt absenc tranquil societi lead rise depress henc wit mankind need embark tough,0.796969696969697,0.20303030303030303,Negative,[],"['depress', 'tough']"
mind want teach women depress taught healthi holist way read,0.7111111111111111,0.28888888888888886,Negative,[],['depress']
jeff dealt comment half life child whole system chang diognos depress anxietynev feel like misunderstood labl someth,0.6912568306010929,0.3087431693989071,Negative,['like'],"['depress', 'misunderstood']"
badsupport tonight rain shine hamont bipolar anxieti depress mhm mentalhealthmatt,1.0,0.0,Negative,[],['depress']
solo rude could depress emoji disappoint reliev face,1.0,0.0,Negative,[],"['rude', 'depress', 'disappoint']"
know feel happi soon depress cant last forev need find happynessi realli hope see,0.5252225519287834,0.4747774480712167,Negative,['hope'],['depress']
wish dad would accept depress tri make light ex normal young peopl messyi know differ lazi depress messi trust wish first oneit scari suck isdepress,0.4513108614232209,0.5486891385767789,Positive,"['wish', 'accept', 'trust', 'wish']","['depress', 'depress', 'suck']"
pain look depress anxieti everi mom read,1.0,0.0,Negative,[],"['pain', 'depress']"
ketamin psychedel mushroom shown reduc depress symptom two studi uk send statesid warn selfmed,1.0,0.0,Negative,[],"['depress', 'warn']"
dont depress circumst decad stagnant wage crumbl infrastructur everywher abandon commerci residenti build market ignor there plenti,0.5241635687732341,0.4758364312267658,Negative,[],"['depress', 'abandon']"
diagnos depress depress depress,1.0,0.0,Negative,[],"['depress', 'depress', 'depress']"
thank much get hard everi often get emot depress suck ass,0.815028901734104,0.18497109826589597,Negative,['thank'],"['hard', 'depress', 'suck', 'ass']"
im end felt come day ago keep product depress probabl never go away hope dark shadow,1.0,0.0,Negative,['hope'],['depress']
luv support park bomlik said noth wrong she innoc depress import thing true disord tri cure prescrib pill doctor wout hurt anyon deserv betteru got back,0.638095238095238,0.36190476190476184,Negative,"['support', 'true']","['wrong', 'depress', 'hurt']"
life excit way lot dramat event occur excit life realli that depress guess,1.0,0.0,Negative,[],['depress']
stop exercis regim abruptli increas risk depress fit healthi health,0.7504,0.2496,Negative,['fit'],"['stop', 'risk', 'depress']"
witch hunt woman take depress pill make petit get someon suicid disgust,1.0,0.0,Negative,[],"['witch', 'depress', 'disgust']"
depress realli defin wear christma sock april,1.0,0.0,Negative,[],['depress']
alway back mind know look ive depress also get stress bodi goe shutdown myhealthyhomelif,1.0,0.0,Negative,[],"['depress', 'stress']"
real depress hour,1.0,0.0,Negative,[],['depress']
beccatoldmeto miss kind torontostrong stolengirl equal ptsd abus depress timesup thewaramp mentalhealth suicid stigma homeless survivor loneli redfriday ig loveislov abil accessal climatechang mmiwg bulli boysmattertoo,0.44954128440366975,0.5504587155963303,Positive,"['kind', 'survivor']","['miss', 'depress']"
neck back crippl depress attack,1.0,0.0,Negative,[],"['depress', 'attack']"
crippl depress,1.0,0.0,Negative,[],['depress']
plan write book deal depress base experi never realli happen though,1.0,0.0,Negative,[],['depress']
yupi studi hsa well wwi wwii depress intern relat histori unth israelipalestinian historyforgotten lot tbh rememb enough concern,0.6024096385542168,0.39759036144578314,Negative,['well'],['depress']
depress exercis decreas chanc develop depress later lifeanoth outstand reason take exercis class help improv phhysic mental heath contact us today detail exercis depress,0.7795275590551181,0.2204724409448819,Negative,['help'],"['depress', 'depress', 'depress']"
depressionyesy suffer alcohol addictionthi caus numbnesstri adderal,1.0,0.0,Negative,[],['suffer']
depress ah feel okay okay sad dont forget peopl care,0.6202046035805626,0.3797953964194373,Negative,"['okay', 'okay', 'care']","['depress', 'sad', 'forget']"
depress exercis decreas chanc develop depress later lifeanoth outstand reason take exercis class help improv phhysic,0.7038834951456311,0.29611650485436897,Negative,['help'],"['depress', 'depress']"
took month real job full fledg depress kick fuck place fuck environ fuck peopl,1.0,0.0,Negative,[],"['depress', 'fuck', 'fuck', 'fuck']"
anxieti rais risk heart diseas previou studi shown arteri stiff may worsen traumat life event job strain depress either,0.7,0.3,Negative,['heart'],"['risk', 'worsen', 'depress']"
imagin start depress hour earli continu vid cri everi second,1.0,0.0,Negative,[],['depress']
weight loss pill may help person lose weight temporarili caus neg side effect sever mood swing depress,0.7521929824561404,0.24780701754385964,Negative,['help'],"['loss', 'lose', 'depress']"
lethargi side effect mild depress anxieti futur proctasturb effect use hour ago,1.0,0.0,Negative,[],['depress']
depress ill make feel sad paranoia ill make feel like none friend like anxieti ill give panic attack trust ill dissapear bit happi come bitch illus,0.8558441558441559,0.14415584415584415,Negative,"['like', 'friend', 'like', 'trust']","['depress', 'ill', 'sad', 'paranoia', 'ill', 'ill', 'panic', 'attack', 'ill', 'bitch']"
infin war chase movi everybodi die sound depress save environ like pipelin activist use car drive got movi seen like,0.5726643598615917,0.42733564013840825,Negative,"['save', 'like', 'like']","['war', 'die', 'depress']"
genomewid associ studi uncov genet variant tie differ depressionrel phenotypesmedscap report investig uncov genet variant link differ depressionrel phenotyp,0.0,0.0,Negative,[],[]
call depress,1.0,0.0,Negative,[],['depress']
depress almost made quit music banki w,1.0,0.0,Negative,[],['depress']
upslop ecg pattern stsegment depress continu tall symmetr wave precordi lead sometim call de winter pattern associ occlus proxim left anterior descend coronari arteri,1.0,0.0,Negative,[],['depress']
either never depress begin dont realiz still,0.0,1.0,Positive,[],['depress']
mannnnn peopl knew struggl depress exercis way releas bad,1.0,0.0,Negative,[],"['depress', 'bad']"
depress meal cold pizza breakfast,1.0,0.0,Negative,[],['depress']
anxieti experienc feel faint dizzi bs that like say everyon depress want kill ridicul generalis,0.6757281553398058,0.3242718446601942,Negative,['like'],"['depress', 'kill']"
may kaklas ako matalino hindi naniniwala na may depress gawa gawa lang prove sh hmm explain everyth depress she realli closemind,1.0,0.0,Negative,[],"['depress', 'depress']"
inquisit way relat charact much also game help though major depress help push realli dark time life,0.38131313131313127,0.6186868686868686,Positive,"['help', 'help']",['depress']
deepika talk day depress time gala indiaforum,1.0,0.0,Negative,[],['depress']
depress prison suffer prison cruel jailer,1.0,0.0,Negative,[],"['depress', 'prison', 'suffer', 'prison', 'cruel']"
got postnat depress birth trauma mum pregnanc matern bump maternalhealth ptsd birthstori matexp birthtraumachat maternitymatt anxieti pblogger pnmh babi parent motherhood pnd postpartum royalbabi,1.0,0.0,Negative,[],"['depress', 'trauma']"
jacki read spurgeon sorrow mustread materi subject christian depress interest,0.687392055267703,0.3126079447322971,Negative,['interest'],"['sorrow', 'depress']"
depress villain state,1.0,0.0,Negative,[],"['depress', 'villain']"
im go twitter bit feel depress sinc pass aunti im upset especi stress ignor sometim add depress,1.0,0.0,Negative,[],"['depress', 'upset', 'stress', 'depress']"
read help mayb good japanes friend struggl anxieti depress,0.2662889518413598,0.7337110481586403,Positive,"['help', 'good', 'friend']",['depress']
fact recess could turn depress stop yr rep pre coolidg cut govt spend leav free mkt individu liberti sector creat growth jo,0.5600907029478458,0.4399092970521542,Negative,"['free', 'growth']","['depress', 'stop', 'cut']"
broke back carri burden dunyalov broke hate shatter depress numb anxieti ignit end naiv soul burden heavilyya rab turn worri feather,1.0,0.0,Negative,[],"['broke', 'burden', 'broke', 'hate', 'depress', 'numb', 'burden']"
wish could one day actual happi ala depress bpd let happen c,0.5417789757412399,0.45822102425876016,Negative,['wish'],['depress']
tomorrow friendli ac mccann vs sevilla depress entri us free,0.4922048997772828,0.5077951002227171,Negative,['free'],['depress']
youv got fever caus u depress,1.0,0.0,Negative,[],['depress']
go back isten older album artist went public depress nutti,1.0,0.0,Negative,[],['depress']
depress medic proof ie medic,1.0,0.0,Negative,[],['depress']
realli want art feel motiv cough cough slight depress coughbut yea ill tri get redraw done soon altho lot project school homework,0.8141263940520446,0.18587360594795538,Negative,[],"['depress', 'ill']"
jonghyun dead depress peopl pl stop sleep mental issu,1.0,0.0,Negative,[],"['dead', 'depress', 'stop']"
yake im goin depress lol,0.5337331334332833,0.4662668665667166,Negative,['lol'],['depress']
go allow depress take life mental health go downhil im go let,0.6272189349112427,0.3727810650887574,Negative,['allow'],['depress']
know say help aint tri offend know depress drug addict dont blend,0.41163793103448276,0.5883620689655172,Positive,['help'],"['offend', 'depress']"
bad day depress boyfriend tri mood tho babe fuck,1.0,0.0,Negative,[],"['bad', 'depress', 'fuck']"
smile even forc indic mind your happi turn caus brain releas endorphin bodi feelgood chemic combat depress anxieti,0.6914285714285715,0.3085714285714286,Negative,['smile'],"['combat', 'depress']"
season depress dreari day check past pool spa job cheer warm weather degre day right around corner next week hold tight poolbuild pooldesign mcgrath photographi,0.3804347826086956,0.6195652173913043,Positive,"['cheer', 'warm']",['depress']
oh god guy sr he deadass make fun depress hope choke,0.44677871148459386,0.5532212885154062,Positive,"['god', 'fun', 'hope']","['depress', 'choke']"
