Tweet,Negative,Positive,Overall Sentiment,Positive Words,Negative Words
lack understand small signific part caus anxieti depress feel incred lone soooo easi compar easi invalid,1.0,0.0,Negative,[],"['lack', 'depress', 'lone']"
told parent depress hard get gen x peopl understand someth control time cure walk keep mind busi,1.0,0.0,Negative,[],"['depress', 'hard']"
depress someth dont speak even go also doubl edg sword love everi race even white peopl done much cant hate grandma legit white tf hate dislik peopl though,0.4891891891891892,0.5108108108108108,Positive,['love'],"['depress', 'hate', 'hate']"
made tortilla fill pbj depress cure olivia depress,1.0,0.0,Negative,[],"['depress', 'depress']"
gon na need depress med soon rainout spin equilibrium emoji pout face mother natur mean bth emoji face symbol mouth,1.0,0.0,Negative,[],['depress']
anxieti depress fight who day,1.0,0.0,Negative,[],"['depress', 'fight']"
wow she suddenli cure depress gave us world peac,0.458,0.542,Positive,['wow'],['depress']
offici done neptun justin timberlak timbaland got depress younger lot artist chang sound still support far,0.5420875420875421,0.4579124579124579,Negative,['support'],['depress']
what wrongmi girl look look depress stress facem babe examseason,1.0,0.0,Negative,[],"['depress', 'stress']"
mp agre emoji clap hand sign emoji clap hand sign emoji clap hand signa someon long experi clinic depress id like add thisof cours fuckingwel yell hit,0.20975609756097557,0.7902439024390243,Positive,"['hand', 'hand', 'hand', 'like']",['depress']
told mom feel put dnd bc dont energi hear pray depress,1.0,0.0,Negative,['pray'],['depress']
pan ghey friend lean leftist side polit medic depress showin face without makeupdo yall think itll,0.5,0.5,Negative,['friend'],['depress']
your fine bit product school your home burnout occasion depress get end semest,0.6389776357827477,0.3610223642172524,Negative,['fine'],['depress']
think would know depress quit rare slump paralyz state want dark room away anybodi els everi week would wake morn noth seem right,0.7102272727272728,0.2897727272727273,Negative,[],['depress']
kinda remind suffer depress got help decid chop hair there studi peopl suffer dramat event often chose get dramat hair chang recov,0.7813267813267812,0.21867321867321865,Negative,['help'],"['suffer', 'depress', 'suffer']"
he right lotta peopl deal depress find hard come term,1.0,0.0,Negative,[],"['depress', 'hard']"
depress,1.0,0.0,Negative,[],['depress']
gener anxieti disord v mild depress,1.0,0.0,Negative,[],['depress']
heal anxieti depress fibromyalgia natur via,1.0,0.0,Negative,[],['depress']
block fake ppl cut,1.0,0.0,Negative,[],"['block', 'fake', 'cut']"
chaotic depress u even deserv food,1.0,0.0,Negative,[],"['chaotic', 'depress']"
depress psshare,1.0,0.0,Negative,[],['depress']
idk like u know u get closer exam u get feel depress,0.6485260770975056,0.35147392290249435,Negative,['like'],"['idk', 'depress']"
uhhh idk yall wan na see rant like kinda need sorri advanc swear everi time talk mental health irl one care like ppl tell get stop depress cant control depress one fuck,0.5614366729678638,0.43856332703213613,Negative,"['like', 'care', 'like']","['idk', 'rant', 'stop', 'depress', 'depress', 'fuck']"
dont psycholog condit anxieti disord depress,1.0,0.0,Negative,[],['depress']
crazi much better feel much achiev get depress emoji person fold hand,0.34448818897637795,0.6555118110236221,Positive,"['better', 'hand']",['depress']
hello queen know go qa want ask anxieti depress etc btw lysm queen oh btw follow instagram account queenxxlarray ya better check ilysm wonder day bad,0.6144578313253012,0.38554216867469887,Negative,['better'],"['depress', 'bad']"
kany west lose follow day like trump lose follow like trump spiral depress emoji face tear joy guess rel,0.49475524475524474,0.5052447552447552,Positive,"['like', 'like', 'joy']","['lose', 'lose', 'depress']"
someon take mushi depress brain give new one thx,0.5612472160356348,0.4387527839643653,Negative,['thx'],['depress']
kotaku ign playstat dont tell god war actual cure depress,0.614100185528757,0.385899814471243,Negative,['god'],"['war', 'depress']"
feel empti worthless failur hopeless unwant joke fuck embarrass depress borderlineperson mentalil bipolar anxieti,0.8705882352941177,0.12941176470588237,Negative,['joke'],"['worthless', 'hopeless', 'fuck', 'embarrass', 'depress']"
move depress cloud enjoy usual feel activ,0.5,0.5,Negative,['enjoy'],['depress']
lose anger anxieti insecur depress medit buddha via,1.0,0.0,Negative,[],"['lose', 'anger', 'depress']"
syo kurusu who cur depress day day energet smile light dark soul im bless life thank,0.2907949790794979,0.7092050209205021,Positive,"['smile', 'bless', 'thank']",['depress']
wherea show tv design make feel guilti larg regardless whether your otherwis happi size notthos wonder improv depress peopl right,1.0,0.0,Negative,[],['depress']
undiagnos learn disabl dont learn well school envrion system play state dont work hard enough your object worthless wan na know depress go look school,0.6811989100817439,0.3188010899182562,Negative,"['well', 'play']","['hard', 'worthless', 'depress']"
depress,1.0,0.0,Negative,[],['depress']
respons chri hipkin repli student depress ration counsel,1.0,0.0,Negative,[],['depress']
shane respond lame mothman pun depress cure,1.0,0.0,Negative,[],"['lame', 'depress']"
onlin cognitivebehavior therapi anxieti depress mind therapi via skype peopl see big improv within week contact learn schedul skype therapi session,1.0,0.0,Negative,[],['depress']
antidepress daydepress joy antidepress medicin hope rest faith god inspir encourag peac antidepressantoftheday happi,0.0,1.0,Positive,"['joy', 'hope', 'faith', 'god']",[]
realli tri activ havent motiv latelydepress frida,0.0,0.0,Negative,[],[]
im glad think quot tell someon research go best depress differ everyon dont know hard grasp think someon,0.2741228070175438,0.7258771929824561,Positive,"['glad', 'best']","['depress', 'hard']"
distanc make heart grow fonder make heart grow depress,0.2761760242792109,0.723823975720789,Positive,"['heart', 'heart']",['depress']
end worst yr emoji face tear joy realli depress,0.6579352850539291,0.3420647149460709,Negative,['joy'],"['worst', 'depress']"
one understand much help serious never better place havent see mental health long time reliev stress depress sometim need someon help make thing better thankfulemoji heavi red heart,0.4372623574144487,0.5627376425855513,Positive,"['help', 'better', 'help', 'better', 'heart']","['stress', 'depress']"
depress lone room full peopledepress constantli tire never abl sleepdepress smile hide pain insidedepress soul die bodi keep goingdepress forget use,1.0,0.0,Negative,['smile'],"['depress', 'lone', 'hide', 'pain', 'die', 'forget']"
wizard cav lose ill spiral crippl depress,1.0,0.0,Negative,[],"['lose', 'ill', 'depress']"
dont think peopl recogn much adhd affect person life lot time adhd one multipl diagnos person may receiv usual someth like major depress bipolar someth els get blame person life suck,0.7796610169491525,0.22033898305084743,Negative,['like'],"['depress', 'blame', 'suck']"
depress decid rear ugli head sadli spark jealousi hate jealou day kinda tank week plung depth,0.7846534653465346,0.21534653465346532,Negative,['spark'],"['depress', 'hate']"
brinkhof eat tend sign depressionmayb werent unattract unhealthi tri better start lose weightexercis would start feel less depress worthlesssound lik,0.6586826347305389,0.34131736526946105,Negative,['better'],"['lose', 'depress']"
ilgen work inpati psychiatri certainli notic bia overdiagnos schizophrenia underdiagnos depress bipolar disord africanamerican rel,1.0,0.0,Negative,[],['depress']
would someon like cure depress give,0.5612244897959183,0.43877551020408156,Negative,['like'],['depress']
wip art grandmer memer mom back day havent made ton progress fight depress nightmar ugh got pull togeth,1.0,0.0,Negative,['progress'],"['fight', 'depress', 'ugh']"
insecur depress psycholog project,1.0,0.0,Negative,[],['depress']
promis your go rough time anxieti depress whatev case may journal help emoji cherri blossom emoji sunflow youv bad day write youv good day write help emoji smile face smile eye,0.3348017621145375,0.6651982378854626,Positive,"['help', 'good', 'help', 'smile', 'smile']","['depress', 'bad']"
crap that probabl depress talk,1.0,0.0,Negative,[],"['crap', 'depress']"
want nice weekend that depress kick ass month still want enjoy miser ok,0.4675810473815461,0.5324189526184538,Negative,"['nice', 'enjoy', 'ok']","['depress', 'ass', 'miser']"
feel depress come back emoji weari face,1.0,0.0,Negative,[],['depress']
thing season depress springsumm ask friend,0.5,0.5,Negative,['friend'],['depress']
save depress shine shawol onew jonghyun key minho taemin,0.5,0.5,Negative,['save'],['depress']
well absolut shit day sick life take shot everi fuck day point tri suppos make effort dig deeper depress anger stresssorri shortcrappi stream honestli dont know ill back,0.7956777996070727,0.20432220039292728,Negative,['well'],"['shit', 'sick', 'fuck', 'depress', 'anger', 'ill']"
grass greensun shininglowest test score droppeddepress cure,0.0,0.0,Negative,[],[]
vintag depress era candlewick singl candl holder imperi glass compani,1.0,0.0,Negative,[],['depress']
haha joke asid folx masturb anymor free serotonin still major anxieti depress problem emoji dizzi symbol,0.4305555555555555,0.5694444444444444,Positive,"['haha', 'joke', 'free']","['depress', 'problem']"
depress tear left cri snatch bold,0.5523648648648648,0.4476351351351351,Negative,['bold'],['depress']
goingemoji airplaneearli depress hour,1.0,0.0,Negative,[],['depress']
surgeri fix depress,1.0,0.0,Negative,[],['depress']
wow kelli clarkson get disgust depress experi accident see face men hurt social media,0.7814871016691958,0.21851289833080423,Negative,['wow'],"['disgust', 'depress', 'accident', 'hurt']"
ever get happi flex homi depress,1.0,0.0,Negative,[],['depress']
world suffer great depress,0.6207650273224044,0.37923497267759565,Negative,['great'],"['suffer', 'depress']"
depress activ,1.0,0.0,Negative,[],['depress']
new hyper fixat janel mone love depress,0.43216080402010054,0.5678391959798995,Positive,['love'],['depress']
depress,1.0,0.0,Negative,[],['depress']
realli dont want dont even know want know even tho dont know heart break youpleas dm ill tri best help ive sever depress sinc mani,0.6313725490196078,0.3686274509803921,Negative,"['heart', 'best', 'help']","['ill', 'depress']"
trucker depress armi,1.0,0.0,Negative,[],['depress']
ill never understand peopl use depress attent accessori lmao,0.6061093247588425,0.39389067524115756,Negative,['lmao'],"['ill', 'depress']"
depress isnt alway easi notic kbg,1.0,0.0,Negative,[],['depress']
cant wait depress tend creep back wait much time hand,0.0,1.0,Positive,['hand'],['depress']
depress epic proport,1.0,0.0,Negative,[],['depress']
lad solid sinc ive play p im tempt replay like know that depress speak,0.32926829268292684,0.6707317073170732,Positive,"['solid', 'play', 'like']",['depress']
hate bad day long time sinc ive felt low depress borderlineperson mentalil bipolar anxieti,1.0,0.0,Negative,[],"['hate', 'bad', 'low', 'depress']"
cat soup cohes film death peopl accept refus difficult understand kick gut creat depress person creativ aspir major depress amplifi tend rumin thought,0.8347639484978541,0.1652360515021459,Negative,['accept'],"['death', 'difficult', 'depress', 'depress']"
good time anxieti depress,0.5245683930942895,0.47543160690571046,Negative,['good'],['depress']
uncl tupelo depress demo rsd record store day vinyl,1.0,0.0,Negative,[],['depress']
thank ovama polici prevent recess turn depress miriam accomplish one disput believ anyon believ trump honora,0.33333333333333337,0.6666666666666667,Positive,"['thank', 'accomplish']",['depress']
first appoint tomorrow new care coordin alreadi dread dont want meet despit know im cross frustrat know blame mistak mentalhealthawar ptsd eupd anxieti depress struggl,0.7538071065989848,0.24619289340101522,Negative,['care'],"['dread', 'blame', 'depress']"
b happi split sec depress like neck bitchemoji unamus face,0.5625,0.43749999999999994,Negative,['like'],['depress']
depress everybodi know suffer fxxxking depress great life,0.7069408740359897,0.2930591259640103,Negative,['great'],"['depress', 'suffer', 'depress']"
teenag get poor sleep increas risk depress,1.0,0.0,Negative,[],"['poor', 'risk', 'depress']"
small penisyesy suffer depressionthi caus lonelinesstri adderal,1.0,0.0,Negative,[],['suffer']
accident took depress nap hour,1.0,0.0,Negative,[],"['accident', 'depress']"
battl depress wednesday emoji face thermomet,1.0,0.0,Negative,[],['depress']
stereotyp think complet live um probabl millenni lazi entitl etc total oh whole depress,1.0,0.0,Negative,[],['depress']
r th wed emoji bride veil anniversari morrow she put b n bipolardepressioni dont know,0.0,0.0,Negative,[],[]
see ive learn lot rpdri pan see strong individu inspir mei anxietydepress watch katya miss fame made realiz wasnt normal feel awfuli bulim need help im except recoveryemoji ribbon,0.15202702702702703,0.847972972972973,Positive,"['strong', 'fame', 'help']",['miss']
bowl new hobbi love def help keep depress away,0.3168789808917198,0.6831210191082803,Positive,"['love', 'help']",['depress']
depress realli mf,1.0,0.0,Negative,[],['depress']
post pictur everyday pleaseit help eas away depress,0.5423387096774194,0.4576612903225807,Negative,['help'],['depress']
thing that depress,1.0,0.0,Negative,[],['depress']
extrem sad lack energi hopeless irrit troubl concentr feel guilt symptom major depress,1.0,0.0,Negative,[],"['sad', 'lack', 'hopeless', 'guilt', 'depress']"
depress sad,1.0,0.0,Negative,[],"['depress', 'sad']"
lol nervou know im gon na reject read word gon na give good ol depress,0.5087719298245614,0.49122807017543857,Negative,"['lol', 'good']","['reject', 'depress']"
depress,1.0,0.0,Negative,[],['depress']
actual pictur anxieti depress ocd im middl final,1.0,0.0,Negative,[],['depress']
florid medic domest depress read four agreement collect sleep walk also wake keep warrior wake,0.5,0.5,Negative,['agreement'],['depress']
present senior seminar research today use mushroom treatment depress everyon takehom messag drug,1.0,0.0,Negative,[],['depress']
medic record depress aggress behavior issu bipolar disord much show back ground check ban gun wont fix better back ground check would fix mayb age rais would help ban gun wont fix everyth,0.88,0.12000000000000001,Negative,"['better', 'help']","['depress', 'aggress', 'ban', 'gun', 'ban', 'gun']"
suicid hotlin addict hotlin eat disord hotlin self harm hotlin depress hotlineshar someon might realli need phone number right mrjayv,0.8375,0.16249999999999998,Negative,[],"['harm', 'depress']"
depress exercis decreas chanc develop depress later life,1.0,0.0,Negative,[],"['depress', 'depress']"
vegan emoji cat face tast like depress kurdishwhitebean,0.5614754098360656,0.4385245901639344,Negative,['like'],['depress']
took biggest depress nap life,1.0,0.0,Negative,[],['depress']
read second part tweet phd train psychologist say exactli thing im say lol old model depress low rate actual cure peopl keep peopl trap victim men,0.7754010695187166,0.22459893048128343,Negative,['lol'],"['depress', 'low', 'trap', 'victim']"
mani peopl taken mental health break live whether stress anxieti depress truli sickinthehead individu would use mental health break dont agre opinion,1.0,0.0,Negative,[],"['stress', 'depress']"
sigh depress got best today must rain,0.37647058823529417,0.6235294117647059,Positive,['best'],['depress']
suicid addict eat disord self harm depress,1.0,0.0,Negative,[],"['harm', 'depress']"
log twitter timelin full polit instead joke depress,0.5928270042194093,0.4071729957805907,Negative,['joke'],['depress']
mysuperpow would anti depress,1.0,0.0,Negative,[],"['anti', 'depress']"
good luck depress real stuck insid head rather pay attent outer help tremend emoji face savour delici food emoji umbrellahav good luck stay busi stay happyemoji,0.31296296296296294,0.687037037037037,Positive,"['good', 'luck', 'help', 'good', 'luck']","['depress', 'stuck', 'pay']"
didnt time dubya budget end debt near trilplu anoth tril ws unfund mandat brought book plu declin revenu countercycl spend great repub rece,0.37916666666666665,0.6208333333333333,Positive,['great'],['debt']
never claim met mani happi content peopl work depress hate decis happi aggress argument good look,0.8017543859649122,0.1982456140350877,Negative,['good'],"['depress', 'hate', 'aggress', 'argument']"
suffer chronic depress,1.0,0.0,Negative,[],"['suffer', 'depress']"
anyon resourc depress intuit specif nourish intuit learn thought depress,1.0,0.0,Negative,[],"['depress', 'depress']"
im sure girl work dont like think depress,0.2996575342465753,0.7003424657534246,Positive,"['sure', 'like']",['depress']
wonder donald trump obtain provigil admir jackson side effect includ dri mouth agit nervous mood chang includ confus depress hallucin,1.0,0.0,Negative,[],"['nervous', 'depress']"
depress obsess xxxtentact,1.0,0.0,Negative,[],"['depress', 'obsess']"
happi birthday know bare talk anymor want know your biggest art inspir ever someon who save depress alway bring smile face thank everyth youll go far,0.2519893899204244,0.7480106100795755,Positive,"['save', 'smile', 'thank']",['depress']
teach histori anymor travail modern youth noth compar great depress world war two,0.634469696969697,0.36553030303030304,Negative,['great'],"['depress', 'war']"
meme crippl depress ok meme,0.5925349922239502,0.40746500777604977,Negative,['ok'],['depress']
lol ive honestli go worst depress ive dealt im contain well,0.5984251968503937,0.4015748031496063,Negative,"['lol', 'well']","['worst', 'depress']"
fun fact pandora box emoji skull derg depress chime bc project start vol tsuruda legendsneverdi never heard depress derg wyd life,0.3501483679525223,0.6498516320474778,Positive,['fun'],"['depress', 'depress']"
clarkson amaz much depress parent divorc music help lot music empow mayb write one inner struggl abl dri tear find someon,0.5443037974683544,0.4556962025316456,Negative,['help'],['depress']
im ju real tire peopl claim depress twitter emoji pensiv face,1.0,0.0,Negative,[],['depress']
three common misconcept depress,1.0,0.0,Negative,[],['depress']
almost half adult autism struggl depress,1.0,0.0,Negative,[],['depress']
envi artist use depress bolster work crumpl weight mine,1.0,0.0,Negative,[],['depress']
real psychologist said excersis eat habit cure depress lmao honey wish easi,0.32629558541266795,0.673704414587332,Positive,"['lmao', 'wish']",['depress']
recogn sign depress someon close hearingloss,1.0,0.0,Negative,[],['depress']
evid benefit exercis mental health depress physicalact mentalhealth,0.515748031496063,0.484251968503937,Negative,['benefit'],['depress']
way tweet also confirm suffer mental ill call depress get help,0.7783018867924528,0.22169811320754715,Negative,['help'],"['suffer', 'ill', 'depress']"
need good web seri check giant youtub channel issa rae presentsit hit mani topic anxieti sexual depress postgrad life spiritu friendship intim relationship black perspect disappoint giant,0.5044510385756676,0.49554896142433236,Negative,"['good', 'friendship']","['depress', 'disappoint']"
went depress mode ab month glad im better swear worst couldnt eat couldnt sleep surround peopl stilll felt empti like nobodi side wouldnt wish nobodi dawg gone realli fuck head emoji sneez face emoji hundr point symbol,0.6287015945330295,0.37129840546697035,Negative,"['glad', 'better', 'like', 'wish']","['depress', 'worst', 'fuck']"
face break feel depress creep want die,0.8451327433628318,0.15486725663716816,Negative,[],"['depress', 'die']"
major depress prior dissoci unwel today better guess bless rapid cycl im never mood long,0.380184331797235,0.6198156682027649,Positive,"['better', 'bless']",['depress']
game begin im go get real second challeng year life mani know struggl anxieti depress daili prior medic heavi lexapro proplanolol forgot function,1.0,0.0,Negative,[],['depress']
solitud turn depress,1.0,0.0,Negative,[],['depress']
spot spiral prais call creativ depress give old ye day,1.0,0.0,Negative,[],['depress']
weather improv lift depress overland overland adventuretravel travel europ motorcycl spain,1.0,0.0,Negative,[],['depress']
talk meanxieti he overdepress never start,0.0,0.0,Negative,[],[]
insult peopl actual struggl depress suicid thought everyday idc start rumor fact person let go far sicken ur crazi ur desper attent suicid noth joke bc pain fuck real,0.8806306306306306,0.11936936936936937,Negative,['joke'],"['insult', 'depress', 'sicken', 'pain', 'fuck']"
mani mama postpartum depress mani mom got help itthemedicalmamac postpartumdepress mentalhealth mentalhealthmatt,0.5417789757412399,0.45822102425876016,Negative,['help'],['depress']
peopl relationship mental health problem process differ emoji persev face emoji persev face anxieti depress,1.0,0.0,Negative,[],"['problem', 'depress']"
let hope dont go temporari depress game tonight know dont get outta bed cant eat week happen let fuck go bruin,0.3862275449101797,0.6137724550898204,Positive,['hope'],"['depress', 'fuck']"
blood test anxieti depress metoprolol anxieti dosag,1.0,0.0,Negative,[],['depress']
realli dont know twitter enhanc depress caus dont anyth els im gon na keep annoy mutual dont mute,1.0,0.0,Negative,[],"['depress', 'annoy']"
depress anxieti allergi leav work pm twice row still behind someon send puppi five mayb basket kitten,1.0,0.0,Negative,[],['depress']
neg energi paranorm investig lead depress,1.0,0.0,Negative,[],['depress']
depress meme joke someth claim think cool trendi peopl nearclos depress real seriou plz stop make depress joke u dont,0.5955056179775281,0.4044943820224719,Negative,"['joke', 'cool', 'joke']","['depress', 'depress', 'stop', 'depress']"
makeup review crazi read one girl said product last though depress nap like man someon need check si,0.5610687022900763,0.4389312977099237,Negative,['like'],['depress']
recess depress inflat desinfl deflat fluctuat,1.0,0.0,Negative,[],['depress']
go room depress nap cancel fave one week wednesday,0.6417391304347827,0.3582608695652174,Negative,['fave'],"['depress', 'cancel']"
think experienc precon depress,1.0,0.0,Negative,[],['depress']
depress,1.0,0.0,Negative,[],['depress']
wait kkw know sunken place seem think synonym depress,1.0,0.0,Negative,[],['depress']
like tell cant kid im realli gon na go depress kinda want one next year,0.4776536312849163,0.5223463687150838,Negative,['like'],['depress']
went suffer mental depress unhealthi relationship go back live mom drive beat honda insur make everi two week bedroom crib lexu sport coup make everi two week emoji person fold hand medium skin tone bless,0.5275862068965517,0.4724137931034483,Negative,"['hand', 'bless']","['suffer', 'depress']"
someon tell struggl mental take joke depress anxieti take control live realiz,0.5925925925925926,0.4074074074074074,Negative,['joke'],['depress']
dont think peopl understand serious depress,1.0,0.0,Negative,[],['depress']
sure hope im let depress win though,0.2627646326276463,0.7372353673723537,Positive,"['sure', 'hope', 'win']",['depress']
ad video playlist depress obsess,1.0,0.0,Negative,[],"['depress', 'obsess']"
set coke bottl green vintag antiqu style depress glass cabinet knob drawer pull victorian furnitur restor retro shabbi etsi chichimama cabinetknob,1.0,0.0,Negative,[],['depress']
lay bed listen script wallow depress emoji tire face emoji tire face emoji tire face emoji tire face emoji ok hand sign medium light skin tone emoji ok hand sign medium light skin tone emoji ok hand sign medium light skin tone emoji ok hand sign medium light skin tone emoji ok hand sign medium light skin tone,0.10485933503836319,0.8951406649616369,Positive,"['ok', 'hand', 'ok', 'hand', 'ok', 'hand', 'ok', 'hand', 'ok', 'hand']",['depress']
ye girl handl shit depress depress doesnt,1.0,0.0,Negative,[],"['shit', 'depress', 'depress']"
suicid hotlin addict hotlin eat disord hotlin self harm hotlin depress hotlineshar someon might realli need phone number right,0.8378378378378378,0.16216216216216214,Negative,[],"['harm', 'depress']"
dailyy accord articl switch began prior end civil war end depress passag civil right act occur time support,0.7240506329113924,0.2759493670886076,Negative,['support'],"['war', 'depress']"
thank god final decid open anxietydepress parent honestli regret sooner forev grate love emoji person fold hand medium skin tone emoji heavi red heart,0.14785992217898833,0.8521400778210116,Positive,"['thank', 'god', 'love', 'hand', 'heart']",['regret']
lost father suicid god almost lost mom drug abus god midst sever depress hopeless god us landon everyth chang thank lord everyday save life familyemoji heart arrow,0.39279869067103107,0.6072013093289689,Positive,"['god', 'god', 'god', 'thank', 'save', 'heart']","['lost', 'lost', 'depress', 'hopeless']"
thank dear friend jennif gustafson share emoji heavi red heart mark hickerson start support group anxieti depress mental health concern mental health common,0.15480427046263345,0.8451957295373665,Positive,"['thank', 'dear', 'friend', 'share', 'heart', 'support']",['depress']
arsonistscomplain dont put emoji fire fast enough tour like challeng find dem left market base crash like great depress grea,0.34608378870673956,0.6539162112932605,Positive,"['like', 'like', 'great']","['fire', 'crash', 'depress']"
song save life especi deal depress thank brother make im glad could see make record scratch am watch work lot man deserv anybodi,0.2694300518134715,0.7305699481865285,Positive,"['save', 'thank', 'glad']",['depress']
firstofakind studi examin peopl level stress anxieti depress affec,1.0,0.0,Negative,[],"['stress', 'depress']"
