Tweet,Negative,Positive,Overall Sentiment,Positive Words,Negative Words
ecl day tri cram organ chemistri back head final tomorrow ugh,1.0,0.0,Negative,[],['ugh']
eff bitch dunkin donut,1.0,0.0,Negative,[],['bitch']
elis melani shiz,0.0,0.0,Negative,[],[]
elli text say quottheyr gona read text quot speak mcfli,0.0,0.0,Negative,[],[]
emot,0.0,0.0,Negative,[],[]
everton fc got beat final fa cup chealea fc oh well least got final play well,0.0,1.0,Positive,"['well', 'play', 'well']",[]
everton oh well lol,0.0,1.0,Positive,"['well', 'lol']",[]
everi fuck day,1.0,0.0,Negative,[],['fuck']
everi one talk msn gone offlin wont abl talk till tomorrow feel lone x,1.0,0.0,Negative,[],['lone']
everi often catch reflect amp think that one cool sonofabtch today one day,0.0,1.0,Positive,['cool'],[]
everi time leav roomi miss bubu send msg he gonesam sideit hapnin dayuniversemxit,1.0,0.0,Negative,[],['miss']
everyon drunk,1.0,0.0,Negative,[],['drunk']
everyon die bordeirln svu,1.0,0.0,Negative,[],['die']
examshelp,0.0,0.0,Negative,[],[]
expens car repair,0.0,0.0,Negative,[],[]
explor twitter,0.0,0.0,Negative,[],[]
famp red wing,0.0,0.0,Negative,[],[]
fail inspect know pass wooven woantitip bracket sold woven wors tax,1.0,0.0,Negative,[],['fail']
fail everyth give,1.0,0.0,Negative,[],['fail']
fame michigan bookstor close door,0.0,1.0,Positive,['fame'],[]
famliy go bck home take sister hore ride oh gon na bore day,1.0,0.0,Negative,[],['bore']
farrah fawcett die cancer,1.0,0.0,Negative,[],"['die', 'cancer']"
fcukk,0.0,0.0,Negative,[],[]
fedex kick french open,0.0,0.0,Negative,[],[]
feelin pessimist,1.0,0.0,Negative,[],['pessimist']
feel litl sad,1.0,0.0,Negative,[],['sad']
feel sad leav mumbai,1.0,0.0,Negative,[],['sad']
feel realiti set know beyond point still want follow dream im scare,0.4916467780429594,0.5083532219570406,Negative,['dream'],['scare']
feel bad cali poor thing,1.0,0.0,Negative,[],"['bad', 'poor']"
femal model tortur princ,0.0,0.0,Negative,[],[]
ferret much cooler fish,0.0,0.0,Negative,[],[]
field trip today leav,0.0,0.0,Negative,[],[]
final home bout napp get readi colleg tomorrow ughhh sooo excit,0.0,0.0,Negative,[],[]
final manag check euromillion resultsno million im afraid oh wellyou got ta win,0.0,1.0,Positive,['win'],[]
find hollywood video frequent remodel fact close cancel account much super cheap dvd,0.33810888252148996,0.6618911174785101,Positive,['super'],['cancel']
hope fun quotlisaquot jillian replac lol busi get rosiecak drunk lol lt u xo,0.16830065359477123,0.8316993464052288,Positive,"['hope', 'fun', 'lol', 'lol']",['drunk']
miss allimma call u tomorrowand reduc number qs tomorrow plsi phobia lol serious,0.5724770642201834,0.4275229357798165,Negative,['lol'],"['miss', 'phobia']"
followfriday ppl catch crab,0.0,0.0,Negative,[],[]
light bit punch missionsan francisco gin mexican liqueur seem apt name,0.0,0.0,Negative,[],[]
death super emo stupid stuff rn sg make feel better p,0.5179640718562875,0.48203592814371266,Negative,"['super', 'better']","['death', 'stupid']"
giant bullpen lose lead,1.0,0.0,Negative,[],['lose']
amp anyon els said someth,0.0,0.0,Negative,[],[]
galaxi mean best religion thing follow right way,0.0,1.0,Positive,['best'],[]
bow raid quotdunnquot back inn speedi recoveri mate,0.0,0.0,Negative,[],[]
yeahuhh,0.0,0.0,Negative,[],[]
wors day ever boss spazz work final done late night photo shoot flat,1.0,0.0,Negative,[],['shoot']
call cheeseburglar made sad,1.0,0.0,Negative,[],['sad']
didnt win first award nomin oh well she tie nomin,0.7378277153558053,0.2621722846441948,Negative,"['win', 'award', 'well']",[]
say quotcrush commiesquot sad grandfath rip commi,1.0,0.0,Negative,[],['sad']
well none us get aliv would like stay whilei wish peopl would stop kill,0.4852941176470588,0.5147058823529412,Negative,"['well', 'like', 'wish']","['stop', 'kill']"
prodigi boston day boo roll summer alreadi x,0.0,0.0,Negative,[],[]
sorrygot carri away gossip anoth note pass hippo birdi amp big koala hug kri xoxo k,0.19306930693069305,0.8069306930693069,Positive,"['hug', 'xoxo']",['gossip']
offic know hard believ peopl dont want employ,1.0,0.0,Negative,[],['hard']
lmaolt,0.0,0.0,Negative,[],[]
hi ur back amp ur next mk gona need realli good hug friend liam give ok,0.0,1.0,Positive,"['good', 'hug', 'friend', 'ok']",[]
lost group that good thing k follow,0.44204322200392926,0.5579567779960707,Positive,['good'],['lost']
guardian uk student report kill crackdown violent clash iran,1.0,0.0,Negative,[],"['kill', 'violent']"
galaxi badli one know that got far,0.0,0.0,Negative,[],[]
said flickr mac wouldnt instal os x ye quota userfocus design goe explod colostomi bagquot,0.0,0.0,Negative,[],[]
cheer emo kid,0.0,1.0,Positive,['cheer'],[]
lvatt com,0.0,0.0,Negative,[],[]
error,1.0,0.0,Negative,[],['error']
error,1.0,0.0,Negative,[],['error']
dinger regret pop pill,1.0,0.0,Negative,[],['regret']
month bed alreadi fail see,1.0,0.0,Negative,[],['fail']
day havent tlkd mi amorim kinda stubborn come bfi callnot bugaboo type,1.0,0.0,Negative,[],['stubborn']
hear jon n katecoupl steer clear realiti show say,0.0,1.0,Positive,['clear'],[]
ncaa nation softbal champion uw huski,0.0,1.0,Positive,['champion'],[]
nd item arriv still wait show aramex web page,0.0,0.0,Negative,[],[]
finish paper smh,1.0,0.0,Negative,[],['smh']
first day alway goodwish dentist gave hour though,0.0,0.0,Negative,[],[]
fone offcant talk loveimu marcu,0.0,0.0,Negative,[],[]
fact didnt get work done,0.0,0.0,Negative,[],[]
forgot xbl today check see game xbla want buy oh well mayb tomorrow,0.0,1.0,Positive,['well'],[]
found mosquito bite tend get realli swollen red distract caffein,1.0,0.0,Negative,[],['distract']
found way make privat woot woot,0.0,1.0,Positive,"['woot', 'woot']",[]
four fake peopl ad peopl dont like twitter,1.0,0.0,Negative,['like'],['fake']
frank iero sexiest vegetarian,0.0,0.0,Negative,[],[]
french lost fb,1.0,0.0,Negative,[],['lost']
fuck man hate work suckss,1.0,0.0,Negative,[],"['fuck', 'hate']"
fuck,1.0,0.0,Negative,[],['fuck']
fuck money run amp job,1.0,0.0,Negative,[],['fuck']
fuck ugli person,1.0,0.0,Negative,[],['fuck']
fuck rur mom,1.0,0.0,Negative,[],['fuck']
fwd good mornhappi birthday regardless ppl said yesterdaythey dont realiz happend behind sceneon,0.0,1.0,Positive,['good'],[]
gah much less ok tri tell,0.0,1.0,Positive,['ok'],[]
gcse clearli suck,1.0,0.0,Negative,[],['suck']
geez chelsea alreadi score everton,0.0,0.0,Negative,[],[]
gerald lost friendidk saythi like day crazi event,0.4797297297297297,0.5202702702702703,Positive,['like'],['lost']
get quotgoodbyequot email iran iranelect,0.0,0.0,Negative,[],[]
get mani pedi husband,0.0,0.0,Negative,[],[]
get webcam today,0.0,0.0,Negative,[],[]
get readi leav spring citi tn im go miss show tonight,1.0,0.0,Negative,[],['miss']
get readi watch sprint cup boy tri tame concret monster mile hope tire wont much issu,0.0,1.0,Positive,['hope'],[]
girl girl dont fight there enough go around,0.0,1.0,Positive,[],['fight']
gnight phone suck bleh,1.0,0.0,Negative,[],['suck']
gnight tweeti lt talk haha work,0.0,1.0,Positive,['haha'],[]
go away migrain welcom,0.0,0.0,Negative,[],[]
go away rain,0.0,0.0,Negative,[],[]
go follow person twitter,0.0,0.0,Negative,[],[]
go wing ftw,0.0,1.0,Positive,['ftw'],[]
god im earli hayley still asleep today parti day im get stuff readi x,0.0,1.0,Positive,['god'],[]
go home see babi dont asham faith,1.0,0.0,Negative,['faith'],[]
go dinner famili,0.0,0.0,Negative,[],[]
go bed,0.0,0.0,Negative,[],[]
go bed,0.0,0.0,Negative,[],[]
name,0.0,0.0,Negative,[],[]
go get pia colada mix wallow sorrow,1.0,0.0,Negative,[],['sorrow']
go bad day love x cant believ back someon,0.4541984732824427,0.5458015267175572,Positive,['love'],['bad']
go lay fuck tonight,1.0,0.0,Negative,[],['fuck']
go london expo weekend cant wait,0.0,0.0,Negative,[],[]
go master class without car miss vw,0.0,1.0,Positive,[],['miss']
goingg sleep school pizzaa,0.0,0.0,Negative,[],[]
gon na miss jess mccartney live stream kiss concert cuz babysit figur dont internet klfjhadsklfhk fml,0.36401673640167365,0.6359832635983264,Positive,['kiss'],['miss']
gon na wow bit later twitter lt,0.0,1.0,Positive,['wow'],[]
good luck,0.0,1.0,Positive,"['good', 'luck']",[]
good morn love,0.0,1.0,Positive,"['good', 'love']",[]
good morningafternoon thing great today,0.0,1.0,Positive,"['good', 'great']",[]
ff ltff themtommi chi allday kslyflyjunc manhattanatl owww wordsmith fiyah,0.0,1.0,Positive,['ff'],[]
onlin realiti blog amp tweet life social media dlist,0.0,0.0,Negative,[],[]
asmith ooh clean sheet day awesom woo hope your feel better,0.0,1.0,Positive,"['clean', 'woo', 'hope', 'better']",[]
famili friend die also old art teacher sad madcap teacher like,0.5512422360248448,0.4487577639751553,Negative,"['friend', 'like']","['die', 'sad']"
think ive battl impend crud enjoy drive,0.0,1.0,Positive,['enjoy'],[]
crickey cant think far ahead think get follow pretti ambiti,0.0,0.0,Negative,[],[]
coffe keep run fact without coffe wouldnt get exercis,0.0,0.0,Negative,[],[]
got lazi bum chalean burn interv turn fascin shade puce wonder oxygen went,0.0,0.0,Negative,[],[]
bookmark check get sleep thank sam,0.0,1.0,Positive,['thank'],[]
im sad leav hour u didnt even miss anywho um still luv u what get frozen turkey,0.6824034334763949,0.31759656652360513,Negative,[],"['sad', 'miss']"
quotit alway next movequot napoleon hil,0.0,0.0,Negative,[],[]
ur hot,0.0,0.0,Negative,[],[]
that remov bot like weed garden fun must done eventu,0.0,1.0,Positive,"['like', 'fun']",[]
hubbi briso dvd havent seen yet enjoy saw armi dark evil dead hub,1.0,0.0,Negative,['enjoy'],"['evil', 'dead']"
consider tooth fairi check make sure didnt miss anyon,0.0,1.0,Positive,['sure'],['miss']
perfectli schedul nobodi waist time today dont mention sun dedic audienc,0.0,0.0,Negative,[],[]
twenti look bed wonder thirti look bezzzzzzzzzzzzz,0.0,0.0,Negative,[],[]
galaxi badli one know much that got far,0.0,0.0,Negative,[],[]
werent unspeak thing dont know id,0.0,0.0,Negative,[],[]
bellacullen ive ok got cri leah frown thought talk dead father,0.6610978520286396,0.3389021479713603,Negative,['ok'],['dead']
cook,0.0,0.0,Negative,[],[]
nci,0.0,0.0,Negative,[],[]
follow wow,0.0,1.0,Positive,['wow'],[]
follow yay,0.0,1.0,Positive,['yay'],[]
make wishhh lt goodnight,0.0,0.0,Negative,[],[]
know im wish,0.0,1.0,Positive,['wish'],[]
day jbconcert milanim guard ticket,0.0,0.0,Negative,[],[]
day month left mb left onpeak download,0.0,0.0,Negative,[],[]
week class week exam blockk holiday holland australia x,0.0,1.0,Positive,['holiday'],[]
week,0.0,0.0,Negative,[],[]
day twitter im back think,0.0,0.0,Negative,[],[]
morrow last day skool im gon na miss everyon that leav special mel mel bye bye good night twitter lt,0.2222222222222222,0.7777777777777777,Positive,"['special', 'good']",['miss']
lb lost sinc feb still lot go,1.0,0.0,Negative,[],['lost']
minut lunchtim left bad time album arriv yay,0.5065420560747663,0.4934579439252336,Negative,['yay'],['bad']
good night okay got realli noth say,0.0,1.0,Positive,"['good', 'okay']",[]
good night arrgghhhh bp work boy,0.0,1.0,Positive,['good'],[]
good hear,0.0,1.0,Positive,['good'],[]
good weekend,0.0,1.0,Positive,['good'],[]
goodby cwg life,0.0,0.0,Negative,[],[]
goodby hair length,0.0,0.0,Negative,[],[]
goodnight mathampspanish final tomorrow spanish easi woo,0.0,1.0,Positive,['woo'],[]
gooooood morn twitter friend nice sunday,0.0,1.0,Positive,"['friend', 'nice']",[]
gossip girl tonight,1.0,0.0,Negative,[],['gossip']
got burn realli bad due constantli wet reappli sunscreen,1.0,0.0,Negative,[],['bad']
got escala new album ti good,0.0,1.0,Positive,['good'],[]
got new photoshop magazin need dad portabl cd drive use cd pic think im stuck tomorrow,1.0,0.0,Negative,[],['stuck']
got sunburnt today anoth day paradis swim ship pool,0.0,0.0,Negative,[],[]
got work ughhhh longgg day ahead,0.0,0.0,Negative,[],[]
got ta love glad fun look forward beach w,0.0,1.0,Positive,"['love', 'glad', 'fun']",[]
graveyard charg card twice one correct total one random amt last night atltweet tweetup check account,1.0,0.0,Negative,[],['graveyard']
great fuck great,0.299,0.701,Positive,"['great', 'great']",['fuck']
name,0.0,0.0,Negative,[],[]
great fall tribun stori talk scout titl stori theme prepar back countri travel,0.0,1.0,Positive,['great'],[]
great dad lock car n n hour home,0.0,1.0,Positive,['great'],[]
great nite,0.0,1.0,Positive,['great'],[]
great tight good outfit,0.0,1.0,Positive,"['great', 'good']",[]
great got fake present explain oper system view event driven applic dont get,0.43037974683544306,0.569620253164557,Positive,['great'],['fake']
great,0.0,1.0,Positive,['great'],[]
greatrosi sooo close get long overdu rosi day waittil anoth daysad,0.0,0.0,Negative,[],[]
grr youv chang dont like havent call momo week,1.0,0.0,Negative,['like'],[]
grrrrr cant go away like day haha stupid pack mexico bye,0.6472868217054264,0.3527131782945736,Negative,"['like', 'haha']",['stupid']
gud bye laptop damnmi mom confisc laptop june soo saadd,0.0,0.0,Negative,[],[]
guess gon na lone night someon save pleas,0.39658848614072495,0.603411513859275,Positive,['save'],['lone']
guess im miss,1.0,0.0,Negative,[],['miss']
gut hope come soon,0.0,1.0,Positive,['hope'],[]
guy prick gon na earli night cri til fall asleep fuck,1.0,0.0,Negative,[],"['prick', 'fuck']"
h dont know go teh movi sir lolz alot,0.0,1.0,Positive,['lolz'],[]
good night love best bud world adamcheeeserosi,0.0,1.0,Positive,"['good', 'love', 'best']",[]
realli good night stoke thing come,0.0,1.0,Positive,['good'],[]
ok day went fast,0.0,1.0,Positive,['ok'],[]
buy pair welli still denial gon na rain download,0.0,0.0,Negative,[],[]
buy corney ass capriquot ughhhhhhhhhhh im hungri,1.0,0.0,Negative,[],['ass']
cancel great day ahead today,0.32786885245901637,0.6721311475409836,Positive,['great'],['cancel']
yo come home earli co ran money want fuck job none fuck fuck fuckiti fuck fuck,0.5996860282574569,0.4003139717425432,Negative,[],"['fuck', 'fuck', 'fuck', 'fuck', 'fuck']"
hah awesom listen pretti cool love cri loud,0.0,1.0,Positive,"['cool', 'love']",[]
haha realli im call music unlimit tomorrow simontryin like rod,0.0,1.0,Positive,"['haha', 'like']",[]
tomorrow new day,0.0,0.0,Negative,[],[]
msc assign incomplet relief,0.0,1.0,Positive,['relief'],[]
babi fell flat face start bawl forgot wobbley,0.0,0.0,Negative,[],[]
doctor perform lateterm abort us shot church,0.0,0.0,Negative,[],[]
kid school got internship photographi studio im go sleep today stress depress,1.0,0.0,Negative,[],"['stress', 'depress']"
leav newcastl,0.0,0.0,Negative,[],[]
actual might crazi caus love job,0.0,1.0,Positive,['love'],[]
actual quit happi toadi apart agoni bodi abl go outsid l done revis all gd,0.0,1.0,Positive,['l'],[]
ah belhblehbleh famili watch movie ye imm beingg computerr nerd p wish jerkfac would wake one daaayyyi,0.4493927125506073,0.5506072874493928,Positive,['wish'],['nerd']
ah cant stop cri hate seein dog attack,0.3886178861788618,0.6113821138211383,Positive,[],"['stop', 'hate', 'attack']"
ah well im sure well fine,0.0,1.0,Positive,"['well', 'sure', 'well', 'fine']",[]
ahhh tissu look like blow fish cryingahhh im stress fuck,0.7163375224416517,0.2836624775583483,Negative,['like'],"['stress', 'fuck']"
ahhh suck,1.0,0.0,Negative,[],['suck']
ahhhhh worst thing ever happen,1.0,0.0,Negative,[],['worst']
ahhhhhh supernatur se finish like watch season make season alreadi cmon,0.0,1.0,Positive,['like'],[]
alex gaskarth amaz shop would great nooo go movi go see stupid hanni montanni,0.45312499999999994,0.546875,Positive,['great'],['stupid']
want watch awesom new show internet mock oh mock hard suck internet,0.8845528455284554,0.1154471544715447,Negative,[],"['mock', 'mock', 'hard', 'suck']"
bestfriend leav,0.0,0.0,Negative,[],[]
friend seem kitten eat ice cream monday bird,0.0,1.0,Positive,['friend'],[]
text delet landi miss certain one lotttt,0.4329411764705882,0.5670588235294117,Positive,['certain'],['miss']
work complet im pass everyth stress exam us one tomorrow lt day,1.0,0.0,Negative,[],['stress']
carpet clean noth carpet smell bad old hous call carpet cleaner,0.4426559356136821,0.557344064386318,Negative,"['clean', 'cleaner']",['bad']
firend make airport leav,0.0,0.0,Negative,[],[]
messag save voicemail box gone noth listen,0.0,1.0,Positive,['save'],[]
alllway rain aberdeen come sunnnnshin,0.0,0.0,Negative,[],[]
alright back onto bore go bed time soon get earli,0.5,0.5,Negative,['alright'],['bore']
loner,1.0,0.0,Negative,[],['loner']
racit,0.0,0.0,Negative,[],[]
wonder friend tell shut actual bare said anyth,0.0,1.0,Positive,['friend'],[]
ami hit co call drink ladi,0.0,0.0,Negative,[],[]
shocker left sytycd tonight one run cut short,1.0,0.0,Negative,[],"['shocker', 'cut']"
hug quoti wait line get club blip quot,0.0,1.0,Positive,['hug'],[]
dunno id danc storm best dress,0.0,1.0,Positive,['best'],[]
math exam tomorrow make life even bettter,0.0,0.0,Negative,[],[]
second flight cancel,1.0,0.0,Negative,[],['cancel']
annnnnd websit launch bookmark amp check back often itinerari b ad soon,0.0,0.0,Negative,[],[]
anoth dbl shift tomorrow father day mean minim time gpa illest man ever,0.0,0.0,Negative,[],[]
pm lunchtim da boss back town,0.0,0.0,Negative,[],[]
ptr possibl week make sad panda spent k gold total level enchant wont abl farm titanium,1.0,0.0,Negative,[],['sad']
stm playin london tommorow amp london england,0.0,0.0,Negative,[],[]
reallyy pakcricket,0.0,0.0,Negative,[],[]
day music im gon na danc wow wow wow gon na someth like high school music ihihih xoxo petia,0.0,1.0,Positive,"['wow', 'wow', 'wow', 'like', 'xoxo']",[]
follow yesterday,0.0,0.0,Negative,[],[]
new result minut repli hell never get chanc repli,1.0,0.0,Negative,[],['hell']
day till school holiday end,0.0,1.0,Positive,['holiday'],[]
bit depress check local weather forecast next day forecast raini tenth cloudi,1.0,0.0,Negative,[],['depress']
goodmorn back cha,0.0,0.0,Negative,[],[]
lot hack garena server game fun,0.0,1.0,Positive,['fun'],[]
perfect weekend,0.0,1.0,Positive,['perfect'],[]
poni clopclop hill heard long saw would happen brooklyn bar cop horseback,0.0,0.0,Negative,[],[]
adam ong ur read anywher tri followin u back twitter said ur page doesnt exist anymor,0.0,0.0,Negative,[],[]
adorei zoffitcha hj dp ponho foto tpic goodnight twitter,0.0,0.0,Negative,[],[]
next wednesday wont abl snuggl lilli go bed she best dog ever,0.0,1.0,Positive,['best'],[]
turn fan club religion lost two member,0.5,0.5,Negative,['fan'],['lost']
againcaus india definit,0.0,0.0,Negative,[],[]
ah well im enough fun play got legal shake head peopl got illegali,0.15397923875432526,0.8460207612456748,Positive,"['well', 'fun', 'play', 'legal']",['shake']
ahhh noi time sick week go awwwaaayi bah,1.0,0.0,Negative,[],['sick']
aint suppos happi,0.0,0.0,Negative,[],[]
ala feet hurt trek home pun intend gtgt,1.0,0.0,Negative,[],['hurt']
alexa isnt feel well daddi went pick gram hous im head take doctor poor babi,1.0,0.0,Negative,['well'],['poor']
done time final start shute,0.0,0.0,Negative,[],[]
good thing must come end bye bye hampton,0.0,1.0,Positive,['good'],[]
say dam hell,1.0,0.0,Negative,[],['hell']
say sorri ampamp even though still togther feel far apart,0.0,0.0,Negative,[],[]
smile im fairli hapi happen yesterday even though put damper thing cough,0.0,1.0,Positive,['smile'],[]
snow gone didnt take long,0.0,0.0,Negative,[],[]
time thought electr blanki turn turn wasnt fail,0.0,1.0,Positive,[],['fail']
almost done wit paint tire crap sleep timequotin love uquot ziggi marley erykah badu,0.3822714681440444,0.6177285318559557,Positive,['love'],['crap']
almost done dark roast doubl espressone morezooooooooom imjustsayin,0.0,0.0,Negative,[],[]
name,0.0,0.0,Negative,[],[]
alon invis,0.0,0.0,Negative,[],[]
aloneeeeeeee,0.0,0.0,Negative,[],[]
also made master roast dinner follow appl crumbl yum need gym week though,0.0,0.0,Negative,[],[]
alton tower school friday although need leav,0.0,0.0,Negative,[],[]
updat twitter stat,0.0,0.0,Negative,[],[]
immatur year old realli like ninja poniesthat leg,0.0,1.0,Positive,['like'],[]
haha someon dont even know made laugh ryan ross win,0.0,1.0,Positive,"['haha', 'laugh', 'win']",[]
hair look dorki oh well,0.0,1.0,Positive,['well'],[]
hand ball wynn dc score penalti bs,0.0,1.0,Positive,['hand'],[]
hang steven mohler sunday ah,0.0,0.0,Negative,[],[]
hangov good,0.0,1.0,Positive,['good'],[]
happi birthday mom alway first one fall bed cuz someon bed hog,0.0,0.0,Negative,[],[]
happi face,0.0,0.0,Negative,[],[]
happi hour end bummer summer guess ride bike back carson,1.0,0.0,Negative,[],['bummer']
happi sunni,0.0,0.0,Negative,[],[]
happi see,0.0,0.0,Negative,[],[]
happi way thing goingg,0.0,0.0,Negative,[],[]
happi know friend still friend,0.0,1.0,Positive,"['friend', 'friend']",[]
happi spend time mum,0.0,0.0,Negative,[],[]
harsh shisha,1.0,0.0,Negative,[],['harsh']
got phone fr cupla day facebook inbox gt laptop ifon wf sim x,0.0,1.0,Positive,['gt'],[]
got amp listen good charlott,0.0,1.0,Positive,['good'],[]
name,0.0,0.0,Negative,[],[]
someth special mind lt,0.0,1.0,Positive,['special'],[]
hate lifeh come home,1.0,0.0,Negative,[],['hate']
hate fact work instead go dress shop cousin,1.0,0.0,Negative,[],['hate']
hate wait equal hate job hunt,1.0,0.0,Negative,[],"['hate', 'hate']"
headach,0.0,0.0,Negative,[],[]
nice day,0.0,1.0,Positive,['nice'],[]
nice day caus,0.0,1.0,Positive,['nice'],[]
sooo much revbis dont even get go church boo exam,0.0,0.0,Negative,[],[]
get tomorrow,0.0,0.0,Negative,[],[]
take car mechan fml talesfrmsurb,0.0,0.0,Negative,[],[]
havent updat forev,0.0,0.0,Negative,[],[]
havin bad hair day weather helpin mood,1.0,0.0,Negative,[],['bad']
havin fun friend,0.0,1.0,Positive,"['fun', 'friend']",[]
bad day,1.0,0.0,Negative,[],['bad']
terribl day hope everyon els better store,0.0,1.0,Positive,"['hope', 'better']",[]
biggest thought right,0.0,0.0,Negative,[],[]
get tooth pull bright side problem solv,0.4820415879017013,0.5179584120982987,Positive,['bright'],['problem']
name,0.0,0.0,Negative,[],[]
didnt answer voicemail box full dammit,0.0,0.0,Negative,[],[]
healthi butcher exclus chees sexi bread love beer super sparkli wine amp appl fuck tango insid belli,0.30242825607064017,0.6975717439293598,Positive,"['love', 'super']",['fuck']
heard pandora site cool,0.0,1.0,Positive,['cool'],[]
hee hee weird shiver,1.0,0.0,Negative,[],['weird']
hero lose momentum come writer pick,0.4281045751633987,0.5718954248366013,Positive,['hero'],['lose']
hey terri game isnt expens time youll made quit invest,0.0,0.0,Negative,[],[]
heyim backif someon want talk,0.0,1.0,Positive,[],[]
hiccuuppsss,0.0,0.0,Negative,[],[]
gone month middl winter first day im lost alreadi go hurri,1.0,0.0,Negative,[],['lost']
histori final reviewstil done,0.0,0.0,Negative,[],[]
hm nut,0.0,0.0,Negative,[],[]
hmm emotionless,0.0,0.0,Negative,[],[]
hmphtext,0.0,0.0,Negative,[],[]
home finallymak fettuccin relax sore feetsi,0.462608695652174,0.5373913043478261,Positive,['relax'],['sore']
home sweet home final back xd,0.0,1.0,Positive,"['sweet', 'xd']",[]
homeish lolhella fun day thank leela thai thank paul thank michel mufid cristina kittykat awkward moos,0.12830188679245283,0.8716981132075472,Positive,"['fun', 'thank', 'thank', 'thank']",['awkward']
anoth year older,0.0,0.0,Negative,[],[]
comment latest star trek movi nice,0.0,1.0,Positive,['nice'],[]
day way shall releas,0.0,0.0,Negative,[],[]
anyon connect get sold tix duran duran fillmor,0.0,0.0,Negative,[],[]
ap impact altern medicin goe mainstream,0.0,0.0,Negative,[],[]
appar wait til june want paolo candi nooooooooow,0.0,1.0,Positive,[],[]
appl count kama sutra objectionableabscen,0.0,0.0,Negative,[],[]
appl count kama sutra objectionableobscen,0.0,0.0,Negative,[],[]
appl delay releas os,1.0,0.0,Negative,[],['delay']
appl store bbl,0.0,0.0,Negative,[],[]
selena gomez amp taylor lautner go ruin day,1.0,0.0,Negative,[],['ruin']
go take photograph tonight,0.0,0.0,Negative,[],[]
arrrrrrgggh cant wait till next weeeeeeeeek,0.0,0.0,Negative,[],[]
david ed die brilliant author miss skill penmanship,0.5913978494623656,0.40860215053763443,Negative,['brilliant'],"['die', 'miss']"
last success deploy complet soowhat,0.0,1.0,Positive,['success'],[]
least one dead shoot militia potest azadi sq tehran iranelect,1.0,0.0,Negative,[],"['dead', 'shoot']"
tegu x day,0.0,0.0,Negative,[],[]
name,0.0,0.0,Negative,[],[]
cloud threat rain savusavu,1.0,0.0,Negative,[],['threat']
work,0.0,0.0,Negative,[],[]
work postiv attitud,0.0,0.0,Negative,[],[]
athen landmark georgia theater fire,0.648550724637681,0.35144927536231885,Negative,[],['fire']
aw get phone sigh oh well time go masturb gtgt call adamidk goodnight,0.0,1.0,Positive,['well'],[]
aw loopt didnt upload pic want show u guy art,1.0,0.0,Negative,[],[]
awesom,0.0,0.0,Negative,[],[]
awesom day soooooooooooooo happi lt,0.0,0.0,Negative,[],[]
awesom man miss woke think youit look like youv dream,0.26180257510729615,0.7381974248927039,Positive,"['like', 'dream']",['miss']
awesom lt teddi lt,0.0,0.0,Negative,[],[]
aww dont make blush,0.0,0.0,Negative,[],[]
aww alreadi,0.0,0.0,Negative,[],[]
aww saw decapit babi dear side road made sad,0.5434298440979956,0.45657015590200445,Negative,['dear'],['sad']
awww hope u get,0.0,1.0,Positive,['hope'],[]
awww man suckd,0.0,0.0,Negative,[],[]
babi strampelt fast im takt new soul yael naim,0.0,0.0,Negative,[],[]
back nativ,0.0,0.0,Negative,[],[]
back busi xd wirt star love almo page xd listenint afh tv,0.0,1.0,Positive,"['xd', 'love', 'xd']",[]
back pain call anoth therapi annoy,1.0,0.0,Negative,[],"['pain', 'annoy']"
back sch tmr,0.0,0.0,Negative,[],[]
back school mondaywel get ipod touch see yah tomorrow guess,0.0,0.0,Negative,[],[]
bad day,1.0,0.0,Negative,[],['bad']
bad day alreadi,1.0,0.0,Negative,[],['bad']
bad headach,1.0,0.0,Negative,[],['bad']
