Tweet,Negative,Positive,Overall Sentiment,Positive Words,Negative Words
hasnt depress groan ad diagnost criteria mean im justughughuuuughhhhhhhhhhhuuuuuuuughuuuuuuuuuuuuuuuuuuugh,0.0,1.0,Positive,[],['depress']
thread month ago took step address mental health think ive known long time ive anxieti depress issu chose ignor lean turn nose like superior somehow wasnt im,0.34657039711191334,0.6534296028880866,Positive,"['like', 'superior']",['depress']
video new invent twenteacanc diabet dementia depress brain heart liver diseas eyesight,0.4329411764705882,0.5670588235294117,Positive,['heart'],['depress']
realli realli reallyyyyi scare im go postpartum hope tho least paranoid mean wont denial get help depress hit,0.6514851485148515,0.3485148514851485,Negative,"['hope', 'help']","['scare', 'paranoid', 'depress']"
tri keep social activ even dont feel like itll help depress,0.6626746506986029,0.33732534930139724,Negative,"['like', 'help']",['depress']
fall ship partner pull depress constantli say leav want delet drop flip account ship got someon make,0.803125,0.196875,Negative,[],"['depress', 'drop']"
anxieti real depress emoji face cold sweat,1.0,0.0,Negative,[],['depress']
fall depress easi dokeepingthefaith,1.0,0.0,Negative,[],['depress']
pleas support import event rt rt rt rt mentalhealth depress suicidementalhealthawar,0.5429292929292929,0.457070707070707,Negative,['support'],['depress']
cure depress,1.0,0.0,Negative,[],['depress']
transpar moment sometim go spurt struggl feel emot oftentim make consciou effort feel emot think happen natur read somewher could symptom depress,1.0,0.0,Negative,[],['depress']
shoutout depress nap lol,0.5333333333333333,0.4666666666666666,Negative,['lol'],['depress']
like im fun talk ship sometim open depress gener im silli joke around talk seriou mayb childish matter that way reliev stress real complic,0.4742063492063492,0.5257936507936508,Negative,"['like', 'fun', 'joke']","['depress', 'childish', 'stress']"
senior correspond member peer support network mentalhealth journal trauma depress,0.6895306859205775,0.31046931407942235,Negative,['support'],"['trauma', 'depress']"
mom die last week dont rel im alon hard today first day without anxieti depress wan na live give fight like mother,0.6059907834101382,0.3940092165898617,Negative,['like'],"['die', 'hard', 'depress', 'fight']"
isol depress entrepreneur phil hayesst clair startup life lifelesson entrepreneurship selfimprov,1.0,0.0,Negative,[],['depress']
journeyworthi podcast episod flat fit listen explian overcam sever depress start fit compani tune,0.3911007025761124,0.6088992974238876,Positive,"['fit', 'fit']",['depress']
watch jurass park trilog nostalg optimist come depress,0.4847328244274809,0.5152671755725191,Positive,['optimist'],['depress']
depress new obsess,1.0,0.0,Negative,[],"['depress', 'obsess']"
could laugh cloth pr bore interview dont dare question depress bitch,0.4825949367088607,0.5174050632911392,Positive,['laugh'],"['bore', 'depress', 'bitch']"
ive fight sever depress extrem anxieti year anyon close know length ive went escap im still fight say feel come win end lot around emoji heavi red heart,0.5120192307692307,0.4879807692307692,Positive,"['win', 'heart']","['fight', 'depress', 'fight']"
stop dopamin mood elev norepinehrin activ b receptor increas sympathet activ serotonin level decreas anxieti depress oxytocin caus uterin smooth muscl contract activ phase labour period,1.0,0.0,Negative,[],"['stop', 'depress']"
dad rli sent depress cultur,1.0,0.0,Negative,[],['depress']
ye depress round yet,1.0,0.0,Negative,[],['depress']
post concert depress freakin real,1.0,0.0,Negative,[],['depress']
anhedon depress,1.0,0.0,Negative,[],['depress']
love gon na watch wont social life newt depress hour,0.4324324324324324,0.5675675675675677,Positive,['love'],['depress']
someon invit class could learn use essenti oil cure depress due chemic imbalancesnot dramat,1.0,0.0,Negative,[],['depress']
im depress depress alway attack dont feel ok everyday im fight depress suppos happi today peopl day doesnt care peopl feel,1.0,0.0,Negative,"['ok', 'care']","['depress', 'depress', 'attack', 'fight', 'depress']"
gon na front nighttim depress kick see ur go live bring happi that im fan u,0.5815602836879432,0.4184397163120567,Negative,['fan'],['depress']
prescrib medic depress grant illeg sk sell unlik other she humili unabl work want keep kick someon who alreadi l,0.3194805194805195,0.6805194805194805,Positive,"['grant', 'l']",['depress']
got big wave depress work date girl tonight prayform emoji face cold sweat emoji person fold hand light skin tone,0.5,0.5,Negative,['hand'],['depress']
depress slowli crippl seem day leav hous work otherwis im bed,1.0,0.0,Negative,[],['depress']
ive decid battl depress physic fit,0.5612244897959183,0.43877551020408156,Negative,['fit'],['depress']
human need reassur time stress depress make easi influenc godman priest exploit vulner problem go anyway get use g,1.0,0.0,Negative,[],"['stress', 'depress', 'exploit', 'problem']"
nice see final happen india rememb time deepika sat interview share world struggl depress imp celebr share struggl make human,0.30710659898477155,0.6928934010152284,Positive,"['nice', 'share', 'share']",['depress']
next time yall think deepika padukon use depress struggl sympathi gainer take opinion throw trash share peopl like fuck ignor someth peopl face daili basi,0.5880681818181818,0.4119318181818182,Negative,"['share', 'like']","['depress', 'fuck']"
malachi said got bad puerto rican cook fri pan felt shit depress went away,1.0,0.0,Negative,[],"['bad', 'shit', 'depress']"
coachella depress isnt real went hardest weekend beg bed shower year lmaooo,1.0,0.0,Negative,[],['depress']
depress anxieti let know emoji face tear joy,0.45724907063197023,0.5427509293680297,Positive,['joy'],['depress']
appar im state moder depress good day aliv,0.5238095238095238,0.47619047619047616,Negative,['good'],['depress']
celiabedelia hear hear ive live mental ill depress anxieti decad unintent celib issu women never felt need kill itthes men normal th,0.616519174041298,0.3834808259587021,Negative,[],"['ill', 'depress', 'kill']"
edit oversleep depress stress get sick result inconclus,1.0,0.0,Negative,[],"['depress', 'stress', 'sick']"
myth great depress new deal historian commonli contend new deal pivot beat great depress protect american middl class signific,0.34812286689419797,0.6518771331058021,Positive,"['great', 'great', 'protect']","['depress', 'depress']"
jesu depress bad thought control everyday moment escap pl,1.0,0.0,Negative,[],"['depress', 'bad']"
there old coupl behind optometrist wife turn husband said depress husband said yeah guess honestli sound realli sad heart kinda broke littl bit,0.5786026200873362,0.42139737991266374,Negative,"['yeah', 'heart']","['depress', 'sad', 'broke']"
know crippl depress cant even make grill chees bc ur exhaust work hour,1.0,0.0,Negative,[],"['depress', 'exhaust']"
depress come goe im tri keep hold kind thing made realis trust open mind lot thing hope wont hard futur live there mani wonder thing life,0.22693266832917705,0.7730673316708229,Positive,"['kind', 'trust', 'hope']","['depress', 'hard']"
hope everyth gon na fine last year fill betray loneli anxieti depress hit bad im glad angel friend save definit year heal process hope get better,0.3541033434650456,0.6458966565349543,Positive,"['hope', 'fine', 'glad', 'friend', 'save', 'hope', 'better']","['betray', 'depress', 'bad']"
post astral project soul doctor cure depress emoji person rais hand celebr medium skin tone,0.5,0.5,Negative,['hand'],['depress']
depress purest form,1.0,0.0,Negative,[],['depress']
region medic director ajay singh md discuss teen depress chang children go adolesc lead addict drug teen turn opioidaddict epidem,1.0,0.0,Negative,[],['depress']
head anyon anxieti depress embarrass im actual taper zoloft guidanc psychiatrist sinc,1.0,0.0,Negative,[],"['depress', 'embarrass']"
view depress worsen,1.0,0.0,Negative,[],"['depress', 'worsen']"
realiti friend parent hate cope depress,0.6835278858625162,0.3164721141374838,Negative,['friend'],"['hate', 'depress']"
okay acknowledg mental unwel okay put need first okay talk publicthat sole reason peopl gone depress anxieti talk went,0.3602150537634409,0.6397849462365591,Positive,"['okay', 'okay', 'okay']",['depress']
depress full swing today,1.0,0.0,Negative,[],['depress']
myth great depress new deal,0.43864598025387863,0.5613540197461213,Positive,['great'],['depress']
need bandaid depress,1.0,0.0,Negative,[],['depress']
there surpris men suffer depress suicid unimagin rate yet shock see toxic masculin manifest violent public act,1.0,0.0,Negative,[],"['suffer', 'depress', 'shock', 'violent']"
wall one person manag stay heartbreak sorri friendship notgoodenough losingfaith mentalil bipolar depress,0.7044534412955465,0.2955465587044534,Negative,['friendship'],"['heartbreak', 'depress']"
im fuck spoon rn depress ion know,1.0,0.0,Negative,[],"['fuck', 'depress']"
instead ruin torment peopl cant find solut prevent grow rate peopl suffer depress suicidewhen realiz idol human also feel need help,0.8110403397027601,0.18895966029723993,Negative,['help'],"['ruin', 'suffer', 'depress']"
suicid hotlin addict hotlin eat disord hotlin self harm hotlin depress hotlineshar someon might realli need phone number right,0.8378378378378378,0.16216216216216214,Negative,[],"['harm', 'depress']"
never realli dealt depressionanxieti rare speak know lot peopl self diagnos that healthi,0.0,0.0,Negative,[],[]
great thread put depress mode caus cunt,0.6091160220994475,0.39088397790055246,Negative,['great'],"['depress', 'cunt']"
depress via,1.0,0.0,Negative,[],['depress']
schimm great depress back w ur neg,0.43844856661045534,0.5615514333895447,Positive,['great'],['depress']
ad video playlist depress,1.0,0.0,Negative,[],['depress']
stop take med feel better feel better med work mentalhealth bipolar depress,0.4819897084048028,0.5180102915951973,Positive,"['better', 'better']","['stop', 'depress']"
day full insecur depress everi littl thing life even control ahhh feel good,0.5238095238095238,0.4761904761904762,Negative,['good'],['depress']
realli wishyal would stop say check friend yall give af friend depress,0.45805369127516776,0.5419463087248322,Positive,"['friend', 'friend']","['stop', 'depress']"
go lie thought thing unfortun think depress overpow,1.0,0.0,Negative,[],['depress']
anoth person follow admir lot deal summer season depress toow much control mental health problem shitti expect anyon feel kind way season good lord ty,0.39906103286384975,0.6009389671361501,Positive,"['kind', 'good', 'ty']","['depress', 'problem']"
havent song sinc novemb deep depress relief see much ive grown damn,0.656,0.344,Negative,['relief'],"['depress', 'damn']"
hope stave depress long enough get video edit readi commentari thrown,0.5247524752475247,0.4752475247524752,Negative,['hope'],['depress']
epitom depress wtfemoji loudli cri face,1.0,0.0,Negative,[],['depress']
yoga instructor let get ustrasana good pose anxieti depress basic everyon,0.5247524752475247,0.4752475247524752,Negative,['good'],['depress']
anxieti depress control atleast someth emoji face tear joy one less trigger everyth els,0.4565217391304348,0.5434782608695653,Positive,['joy'],['depress']
told depress counsellor dont exactli know feel,1.0,0.0,Negative,[],['depress']
peopl get season depress winter get spring least year last three month emoji face tear joy,0.4564564564564565,0.5435435435435436,Positive,['joy'],['depress']
found cure depress,1.0,0.0,Negative,[],['depress']
feel like new bitch around bf bc affect im like depress anxieti suicid thought bitch,0.6835236541598695,0.3164763458401305,Negative,"['like', 'like']","['bitch', 'depress', 'bitch']"
cold outsid ima build blanket fort bedroom ravish depress emoji smile face smile eye,0.3911007025761124,0.6088992974238876,Positive,"['smile', 'smile']",['depress']
height hell time hast terror tensionlif death want wast mass depress,0.9207650273224043,0.07923497267759562,Negative,[],"['hell', 'terror', 'death', 'depress']"
natasha bedingfield record new music like year omfg pocket full sunshin mayb depress pack bag,0.560655737704918,0.43934426229508194,Negative,['like'],['depress']
exercis regularli cut risk depress studi suggest sky news,1.0,0.0,Negative,[],"['cut', 'risk', 'depress']"
must rememb listen music raini day recip depress disast,1.0,0.0,Negative,[],['depress']
jnfdnjf that deb tell depress see sight,1.0,0.0,Negative,[],['depress']
pore cleareddepress gonebread butter,0.0,0.0,Negative,[],[]
liter work peopl bipolar schizophrenia depress ptsdshit real,1.0,0.0,Negative,[],['depress']
tbh new depress,1.0,0.0,Negative,[],['depress']
depress strike,1.0,0.0,Negative,[],"['depress', 'strike']"
traci great articleemoji ok hand sign medium light skin tone ive recent emerg worst depress ive spent march pray god wouldnt wake could relat youv written start lithium week,0.34419551934826886,0.6558044806517311,Positive,"['great', 'ok', 'hand', 'pray', 'god']","['worst', 'depress']"
feel like social media normal depress caus mani self diagnos depress social media push messag ok ya whole tl depress like im fine,0.5158286778398511,0.48417132216014896,Negative,"['like', 'ok', 'like', 'fine']","['depress', 'depress', 'depress']"
dpenaa depress,1.0,0.0,Negative,[],['depress']
anger depress caus live pleas other,1.0,0.0,Negative,[],"['anger', 'depress']"
deal postpartum depress alon parent,1.0,0.0,Negative,[],['depress']
singl drag cannabi allevi depress eas anxieti slash stress find studi,1.0,0.0,Negative,[],"['drag', 'depress', 'slash', 'stress']"
new studi show exercis prevent depress regardless age gender your never old start feel impact use june kickstart journey healthier happier,0.4166666666666667,0.5833333333333334,Positive,['happier'],['depress']
video meet dr durrani medic doctor train psychiatri einstein healthcar network philadelphia area expertis depress anxieti bipolar disord schizophreniawatch video,1.0,0.0,Negative,[],['depress']
god heard prayer deal much drama friend famili whilst battl depress year ill cure graduat earli get wake next love life everyday spend day teach kid emoji smile face smile eye,0.2928416485900217,0.7071583514099783,Positive,"['god', 'friend', 'love', 'smile', 'smile']","['depress', 'ill']"
aliv made night make day depress hope newday,0.5238095238095238,0.47619047619047616,Negative,['hope'],['depress']
mess cancer regr depress anxeiti aid wtf,1.0,0.0,Negative,[],"['mess', 'cancer', 'depress', 'wtf']"
sibl struggl depress suck much feel helpless like love peopl much there noth make shit better,0.5694249649368863,0.43057503506311356,Negative,"['like', 'love', 'better']","['depress', 'suck', 'helpless', 'shit']"
john carver struggl discourag depress via,1.0,0.0,Negative,[],['depress']
j cole talk make kod lil pump kill edward depress,1.0,0.0,Negative,[],"['kill', 'depress']"
aanam hispan struggl multipl sclerosisrel depress,1.0,0.0,Negative,[],['depress']
stop expos depress u fuck bitcj,1.0,0.0,Negative,[],"['stop', 'depress', 'fuck']"
song cure depress,1.0,0.0,Negative,[],['depress']
nail polish arguabl profit cosmet great depress wasi cheap get lot use one bottleanybodi rememb trend skyrocket aka ecanom recess nail artliztori,0.31428571428571433,0.6857142857142857,Positive,"['profit', 'great']",['depress']
intern public safeti associ ipsa poster depress suicid pt,1.0,0.0,Negative,[],['depress']
live sever anxieti sever depress someth wors hell wouldnt wish upon worst enemi,0.7537688442211056,0.24623115577889446,Negative,['wish'],"['depress', 'hell', 'worst']"
ad video playlist quick updat depress move hous,1.0,0.0,Negative,[],['depress']
wrote stuff ive never realli publicli talk especi part dealt depress back start wasnt easi write still isnt,1.0,0.0,Negative,[],['depress']
suicid hotlin addict hotlin eat disord hotlin self harm hotlin depress hotlineshar someon might realli need phone number right,0.8378378378378378,0.16216216216216214,Negative,[],"['harm', 'depress']"
hi suffer ptsd depress frequent panic attack axienti plz understand may slow respond im fight strong urg dissapear pleas paitent difficult time thankyou apolog inconveni caus u,0.7981651376146789,0.20183486238532108,Negative,['strong'],"['suffer', 'depress', 'panic', 'attack', 'fight', 'difficult']"
month sinc last wrote spoken word current work mainli battl depress pray might abl touch soul also fight demon face everi day sorri ive quiet,0.7174721189591078,0.28252788104089216,Negative,['pray'],"['depress', 'fight']"
depress anxieti patient cancer,1.0,0.0,Negative,[],"['depress', 'cancer']"
go thing time last relationship fall thought felt right realiz choic could damag even fed depress use advantag reason feel genuin sorri,1.0,0.0,Negative,[],['depress']
yea mental problem depress anxieti stress real threat good health test human strength copi everyday problem,0.7081545064377682,0.2918454935622318,Negative,"['good', 'strength']","['problem', 'depress', 'stress', 'threat', 'problem']"
depress make hard focu eda,1.0,0.0,Negative,[],"['depress', 'hard']"
ahutson im qualifi address depress time lose write joy forc rememb write got write first place essayistpoet love languag put,0.4236559139784946,0.5763440860215053,Positive,"['joy', 'love']","['depress', 'lose']"
psycholog news psychiatri news health news psycholog healthexercis blue away healthdayregular exercis reduc risk depress matter age live research suggest,0.8278388278388278,0.17216117216117216,Negative,[],"['risk', 'depress']"
still togeth bersyukur gile sebab dia faham kita bila kita mula stress studi even dia penat kerja dia still sabar someth make happi depress go far away thankyou,1.0,0.0,Negative,[],"['stress', 'depress']"
im undeni feel someth sad depress even anger someth strong carri need medit,0.7516778523489933,0.2483221476510067,Negative,['strong'],"['sad', 'depress', 'anger']"
depress nap product,1.0,0.0,Negative,[],['depress']
survivor postpartum depress arent weak warrior mum,0.39461883408071746,0.6053811659192825,Positive,['survivor'],"['depress', 'weak']"
there shit fund borderlin research bpd folk like ppl depress anxieti bipolar suicid attempt suicid ideat like disord like substanc abus wors social function,0.4755244755244755,0.5244755244755245,Negative,"['like', 'like', 'like']","['shit', 'depress']"
preach depress diseas treat,0.5421686746987951,0.4578313253012048,Negative,['treat'],['depress']
hope insecur dont turn depress emoji smile face smile eye,0.0,1.0,Positive,"['hope', 'smile', 'smile']",['depress']
readi gain depress dangaronpa,0.485006518904824,0.5149934810951761,Positive,['gain'],['depress']
think time want deactiv twitter said dont rate amala someon said caus face look like amala fell depress emoji pensiv face,0.45714285714285713,0.5428571428571428,Negative,['like'],['depress']
pluie south call son honey term endear older gener wouldnt kiss kid depress era gener affection grandchildren ive greet kiss cheek thing friend,0.1393939393939394,0.8606060606060606,Positive,"['kiss', 'affection', 'greet', 'kiss', 'friend']",['depress']
hey rob thank share struggl mental also resili find way ive similar struggl ptsdanxieti depress job firefight ive start new podcast spirit resilienceov,0.5153664302600472,0.4846335697399527,Negative,"['thank', 'share', 'spirit']","['rob', 'depress']"
nigga that insomnia depress talk anxieti futur situat that never ganna happenemoji man facepalm medium skin tone,1.0,0.0,Negative,[],['depress']
physic activ reduc risk depress age find studi,1.0,0.0,Negative,[],"['risk', 'depress']"
lupu neurolog symptom depress seizur cognit dysfunct mood disord cerebrovascular diseas polyneuropathi anxieti,1.0,0.0,Negative,[],['depress']
im suffer post concert depress emoji pensiv face emoji pensiv face emoji pensiv face,1.0,0.0,Negative,[],"['suffer', 'depress']"
realli gon na let anxieti depress get today tune later find,1.0,0.0,Negative,[],['depress']
woodi guthri fought old man trump durn depressionhi word live onwatch listen learnresist,1.0,0.0,Negative,[],['fought']
yeah call sever depress buddi,0.5925349922239502,0.40746500777604977,Negative,['yeah'],['depress']
depress young adult rihanna nude phote increas stamina sexual women sex stori sexi eboni nake,0.5918367346938775,0.40816326530612246,Negative,['stamina'],['depress']
year ago today born late life fill depress ive start leav depress thing behind happi use regret born could never happier born thank everyon keep,1.0,0.0,Negative,"['happier', 'thank']","['depress', 'depress', 'regret']"
inequ cours statement true take refer year find strike top share declin sure trend revers effect great depress eat,0.2625418060200669,0.7374581939799332,Positive,"['true', 'top', 'share', 'sure', 'great']","['strike', 'depress']"
sf state studi address digit addict depress cleanandseren wedorecov partysob,1.0,0.0,Negative,[],['depress']
final come someth im see tweet depress,1.0,0.0,Negative,[],['depress']
depress sever anxieti uncheck year final got drag see shrink yr ago ex tri bathroom sesh lunch decid cant left restaur im,1.0,0.0,Negative,[],"['depress', 'drag']"
zed redcocain jim carey go depress past year especi suicid ex girlfriend break jenni mccarthi sure ud wan na right,0.5811965811965812,0.4188034188034188,Negative,['sure'],['depress']
depress isnt sad chemic imbal brain dont tell someon diabet produc insulin forc,0.5568513119533528,0.44314868804664725,Negative,[],"['depress', 'sad']"
rt worst anxieti depress watch ah minecraft video help keep brain free bad thought found rest rt even though im still struggl mental health rt video help laugh,0.4675572519083969,0.5324427480916031,Positive,"['help', 'free', 'help', 'laugh']","['worst', 'depress', 'bad']"
harri content caus depress,1.0,0.0,Negative,[],['depress']
smoke kill depress,1.0,0.0,Negative,[],"['kill', 'depress']"
sometim tell im bad ass kick depress ass life goodim mom student got,0.5724381625441696,0.4275618374558303,Negative,[],"['bad', 'ass', 'depress', 'ass']"
great depress simul today ss experienc unexpect twist turn face live great engag iaintgotnoleft mrjhmav mrjhtxhistori,0.28051391862955033,0.7194860813704497,Positive,"['great', 'great']",['depress']
depress focus much past anxieti focus much futur peac learn live focu,1.0,0.0,Negative,[],['depress']
depress relat subject like stress anger panic,0.8386004514672686,0.16139954853273136,Negative,['like'],"['depress', 'stress', 'anger', 'panic']"
imagin ruin someon carreer harass year take med depress hate much tri get better pleas learn dont know realli happen yet,0.828125,0.171875,Negative,['better'],"['ruin', 'harass', 'depress', 'hate']"
your ever depress funk look video nate robinson block yao ming shaq,1.0,0.0,Negative,[],"['depress', 'block']"
person tri take care mental health cure depress big ass problem korea open ur motherfuck eye alreadi let go let live,0.7464788732394366,0.2535211267605634,Negative,['care'],"['depress', 'ass', 'problem']"
watch one episod skin im go depress dont think fw show,1.0,0.0,Negative,[],['depress']
design council releas report look design built environ includ hous park use tackl health social issu obes depress,1.0,0.0,Negative,[],['depress']
employe suffer depress,1.0,0.0,Negative,[],"['suffer', 'depress']"
live everi day matter crippl anxieti depress best think manag pretti well mental health issu asid tri rememb everyon struggl tri littl empathi,0.3016759776536313,0.6983240223463687,Positive,"['best', 'well']",['depress']
interestingli small studi san diego found combin low dose oxytocin ketamin therapi may provid effect pain relief peopl live sever treatmentresist pain oxytocin depress,0.7936507936507937,0.20634920634920637,Negative,['relief'],"['low', 'pain', 'pain', 'depress']"
fellow anxieti depress suffer cant wait copi arriv help hope review true ill let know get emoji open book,0.530224525043178,0.46977547495682215,Negative,"['help', 'hope', 'true']","['depress', 'suffer', 'ill']"
today day one hope repeat ever someth aw feel though curs child ill afflict fuck depress fuck,0.8175438596491228,0.18245614035087718,Negative,['hope'],"['ill', 'fuck', 'depress', 'fuck']"
cant even depress nap there fuck mannequin four piec take room,0.5703703703703703,0.4296296296296296,Negative,[],"['depress', 'fuck']"
medic student suicidalid nearli depress similar resid,1.0,0.0,Negative,[],['depress']
depress stori emoji hourglass flow sand emoji book emoji broken heart emoji scroll depress disabl mentalhealth mentalil disabilityblogg disabledblogg spooni purpleeleph,0.6928251121076233,0.3071748878923767,Negative,['heart'],"['depress', 'broken', 'depress']"
wa didnt respond began shake tear soon began stream face continu look bag vision get blurri couldnt hear anyth said like snap real,0.0,1.0,Positive,"['vision', 'like']",['shake']
dont tell peopl cure depress gener need specif dont view bullshit emoji smile face open mouth cold sweat,0.3658536585365854,0.6341463414634146,Positive,['smile'],"['depress', 'bullshit']"
unhealthi food stress depress anxieti,1.0,0.0,Negative,[],"['stress', 'depress']"
year mark th anniversari new deal here weekli truth bomb new deal get us great depress oh yeah wwii didnt get us great depress either wokewednesday,0.6,0.39999999999999997,Negative,"['truth', 'great', 'yeah', 'great']","['bomb', 'depress', 'depress']"
system hey ever tri hypnosi great depress anxieti addict phobia even trauma think talk therapist,0.6772388059701492,0.3227611940298507,Negative,['great'],"['depress', 'phobia', 'trauma']"
twitter realli categori folder like peopl want see tweet depress neg opinion toward work children would total organ folder,0.4572368421052631,0.5427631578947368,Negative,['like'],['depress']
depress,1.0,0.0,Negative,[],['depress']
